service_id,game_id,name,description,price_per_unit,sale_price,icon_url,category,game_name
65,,Summum Bonum,"Buy Destiny 2 Summum Bonum Sword from the latest raid. With this service, you're getting a powerful Legendary Arc Melee weapon. What you'll get: The selected number of Random Rolls or Deepsight Rolls; One of the six raid weapons with a unique Origin Trait; All other Legendary and Exotic raid gear that drops during the service; Experience for your Episode Pass and Artifact. Trust our PROs to farm this gun for you and save you valuable time. The price for our Destiny 2 Summum Bonum boost is fair, as usual.",9.99,,https://skycoach.gg/storage/uploads/products/summum-bonnum1718013607_picture_item.png,Destiny 2,Destiny 2
66,,Master Salvation's Edge Weekly Challenge,Buy Salvation's Edge Master Weekly Challenge boost and get an Adept weapon along with Triumphs and other raid gear. The Master challenge changes every week and requires a different approach to the raid encounters. That's why many players would rather get a boosting service than learn the fresh mechanics of this difficult activity. Weekly Challenge completed on your character (Master Difficulty); Raid Triumph completed (for Iconoclast Title); Adept Weapon guaranteed; All Legendary and Exotic Loot that might drop during the service; Experience for your Season Pass and Artifact. Let the Master Salvation's Edge Weekly challenge carry professionals to do the heavy lifting so you can enjoy the rewards.,8.99,,https://skycoach.gg/storage/uploads/products/master-salvations-edge-weekly-challenge1719422531_picture_item.png,Destiny 2,Destiny 2
67,,The Witness Kill,"Buy Destiny 2 Witness Kill to obtain new raid weapons and gear. With our carry service, you will get: Rewards for killing the last boss of Salvation's Edge; A chance to get the Euphony Exotic Linear Fusion Rifle; Some raid weapons or gear; All the loot that drops during the service; Experience for your Season Pass and Artifact. The ""Buy Red Border Weapon"" option is only available for the first weekly raid completion. You must have at least 20 Spoils of Conquest in the inventory and have the selected weapon unlocked in the Collection . If you select this option after your first weekly completion, we will buy a normal weapon roll, which can be Red Border.",4.99,,https://skycoach.gg/storage/uploads/products/the-witness-kill1718021052_picture_item.png,Destiny 2,Destiny 2
68,,Salvation's Edge Raid Armor,"Show off your raid armor in the Tower: buy Salvation's Edge armor set from Skycoach to access unique raid mods and more: The selected armor pieces (or a full Promised armor set) for your class; Possible weapon and Spoils of Conquest drops; All Legendary and Exotic Loot that might drop during the service; Experience for your Season Pass and Artifact. We know everything about cheap Salvation's Edge raid armor, so trust us to get it fast and safe.",0.89,,https://skycoach.gg/storage/uploads/products/salvations-edge-raid-armor1718616661_picture_item.png,Destiny 2,Destiny 2
69,,Fates Intertwined Emblem,"Buy Fates Intertwined emblem boost and unlock the exclusive Destiny 2 Salvation's Edge sherpa emblem without the need of going through teaching 10 new players how to beat the raid. Using your account, we will help 10 Guardians complete the Salvation's Edge raid for the first time. With the Fates Intertwined emblem service, you will get: A selected amount of Salvation's Edge sherpas; A lot of raid weapons and gear; Chance to get the raid exotic weapon; Season Pass and Artifact experience; Obtain one of the rarest emblems in the D2 raiding community. Just select how many sherpas you need via the slider, and let us do the rest.",113.99,,https://skycoach.gg/storage/uploads/products/fates-intertwined-emblem1726475262_picture_item.png,Destiny 2,Destiny 2
70,,Nullify (Adept),"Buy Destiny 2 Nullify Adept Pulse Rifle from the latest raid. With this service, you're getting one of the best Pulse Rifles in the game. What you'll get: The selected number of Random Rolls or Deepsight Rolls; One of the six raid weapons with a unique Origin Trait; All other Legendary and Exotic raid gear that drops during the service; Experience for your Episode Pass and Artifact. Trust our PROs to farm this gun for you and save you valuable time. The price for our Destiny 2 Nullify Adept boost is fair, as usual.",0.72,,https://skycoach.gg/storage/uploads/products/nullify-adept1718613428_picture_item.png,Destiny 2,Destiny 2
71,,Imminence Adept,"Buy Destiny 2 Imminence Adept Submachine Gun boost to get this powerful weapon from the Salvation's Edge raid. With this service, you're getting one of the best Submachine Guns in the game. What you'll get: The selected number of Random Rolls or Deepsight Rolls; One of the six raid weapons with a unique Origin Trait; All other Legendary and Exotic raid gear that drops during the service; Experience for your Episode Pass and Artifact. Trust our PROs to farm this gun for you and save you valuable time. The price for our Destiny 2 Imminence Adept carry is fair, as usual.",0.99,,https://skycoach.gg/storage/uploads/products/imminence-adept1718613406_picture_item.png,Destiny 2,Destiny 2
72,,Non-Denouement (Adept),"Buy Destiny 2 Non-Denouement Adept Arc Bow from the latest raid. With this service, you're getting one of the best Arc Bows in the game. What you'll get: The selected number of Random Rolls or Deepsight Rolls; One of the six raid weapons with a unique Origin Trait; All other Legendary and Exotic raid gear that drops during the service; Experience for your Episode Pass and Artifact. Trust our PROs to farm this gun for you and save you valuable time. The price for our Destiny 2 Non-Denouement Adept boost is fair, as usual.",10.99,,https://skycoach.gg/storage/uploads/products/non-denouement-adept1718613380_picture_item.png,Destiny 2,Destiny 2
73,,Critical Anomaly (Adept),"Buy Destiny 2 Critical Anomaly Adept Sniper Rifle from the latest raid. With this service, you're getting one of the best Sniper Rifles in the game. What you'll get: The selected number of Random Rolls or Deepsight Rolls; One of the six raid weapons with a unique Origin Trait; All other Legendary and Exotic raid gear that drops during the service; Experience for your Episode Pass and Artifact. Trust our PROs to farm this gun for you and save you valuable time. The price for our Destiny 2 Critical Anomaly Adept boost is fair, as usual.",10.99,,https://skycoach.gg/storage/uploads/products/critical-anomaly-adept1718613311_picture_item.png,Destiny 2,Destiny 2
74,,Vault of Glass Raid,The Vault of Glass Raid completed on your character; A chance to obtain Rare Raid Exotic - Vex Mythoclast; Unique Vault of Glass gear; All other Legendary and Exotic loot that drops during the service; Exp for your Season Pass and Artifact.,6.99,,https://skycoach.gg/storage/uploads/products/vault-of-glass-raid1622634580_picture_item.png,Destiny 2,Destiny 2
75,,Vex Mythoclast,"Buy Destiny 2 Vex Mythoclast boost on our platform and quickly get one of the most iconic Exotic weapons in the game. Our professional players have many years of experience in the game, so you can be sure that your order will be completed as soon as possible! Opt for our D2 Vex Mythoclast Carry now and receive: The Vex Mythoclast Exotic Fusion Rifle obtained on your Account; All unique Vault of Glass Gear that drops during the service; All other Legendary and Exotic loot that drops during the service; Experience for your Season Pass and Artifact. Additional Options Vex Mythoclast Catalyst - Enable this option to receive a Catalyst for this weapon; Vex Mythoclast Catalyst Masterwork - Enable this option to receive Catalyst Masterwork for this weapon; You can also order other raid Exotics on this page. Namely: + Necrochasm; + Conditional Finality; + Collective Obligation; + Eyes of Tomorrow.",26.99,,https://skycoach.gg/storage/uploads/products/vex-mythoclast1644240175_picture_item.png,Destiny 2,Destiny 2
76,,Master Vault of Glass,The Vault of Glass Raid completed on Master Difficulty; A chance to obtain a rare Raid Exotic — Vex Mythoclast; Vaultstrider Exotic Ship obtained on your account; Unique and Pinnacle Vault of Glass gear; All other Legendary and Exotic loot that drops during the service; Exp for your Season Pass and Artifact.,9.99,,https://skycoach.gg/storage/uploads/products/master-vault-of-glass1630606411_picture_item.png,Destiny 2,Destiny 2
77,,Fatebringer,"Buy Destiny 2 Fatebringer at Skycoach and equip one of the most iconic legendary Hand Cannons in the game. Known for its exceptional handling, explosive perks like Firefly, and precision, Fatebringer is the perfect choice for Guardians seeking extra firepower for both PvE and PvP. With our Destiny 2 Fatebringer farm service, you'll receive the following: The Selected number of Fatebringer rolls obtained on your character; If you select 5 Deepsight Rolls, we will unlock a Crafting Pattern; All other legendary and exotic loot that drops during the service; Additional XP for your Season Pass and Artifact.",9.49,,https://skycoach.gg/storage/uploads/products/fatebringer1622633350_picture_item.png,Destiny 2,Destiny 2
78,,Timelost Fatebringer,Timelost Fatebringer Godroll with 2 Random Perks and 2 Guaranteed Perks; (Curated Perk means that this perk you will get guaranteed for any Timelost Fatebringer Roll) All Legendary and Exotic loot that might drop during the service; Exp for your Season Pass and Artifact.,12.99,,https://skycoach.gg/storage/uploads/products/timelost-fatebringer-godroll1626466370_picture_item.png,Destiny 2,Destiny 2
79,,Vault of Glass Patterns Bundle,Get the Patterns and craft the enhanced God Rolls with new and reprised perks. We will farm the Deepsight rolls (5/5) for every weapon in the Vault of Glass raid to obtain the following weapon Patterns: Fatebringer Hand Cannon; Corrective Measure Machine Gun; Praedyth's Revenge Sniper Rifle; Vision of Confluence Scout Rifle; Hezen Vengeance Rocket Launcher; Found Verdict Shotgun;,202.99,,https://skycoach.gg/storage/uploads/products/vault-of-glass-patterns-bundle1738845450_picture_item.png,Destiny 2,Destiny 2
80,,Timelost Corrective Measure,Timelost Corrective Measure Machine Gun rolls; All Legendary and Exotic loot that might drop during the service; Exp for your Season Pass and Artifact.,0.99,,https://skycoach.gg/storage/uploads/products/timelost-corrective-measure1632402363_picture_item.png,Destiny 2,Destiny 2
81,,Timelost Praedyth's Revenge,"Timelost Praedyth's Revenge with 2 Random Perks+Curated "" Feeding Frenzy "" and "" Firefly "" Perks (Curated Perk means that this perk you will get guaranteed for any Timelost Praedyth's Revenge Roll) All Legendary and Exotic loot that might drop during the service Exp for your Season Pass and Artifact",12.99,,https://skycoach.gg/storage/uploads/products/timelost-praedyths-revenge1633259096_picture_item.png,Destiny 2,Destiny 2
82,,Timelost Vision of Confluence,"Timelost Vision of Confluence with 2 Random Perks+Curated "" Zen Moment "" and "" Full Auto "" Perks (Curated Perk means that this perk you will get guaranteed for any Timelost Vision of Confluence Roll) All other Legendary and Exotic loot that might drop during the service Exp for your Season Pass and Artifact",12.99,,https://skycoach.gg/storage/uploads/products/timelost-vision-of-confluence1635886615_picture_item.png,Destiny 2,Destiny 2
83,,Vision of Confluence,"The Selected number of Vision of Confluence obtained on your character; If you select 5 Deepsight Rolls, we will unlock a Crafting Pattern; All other legendary and exotic loot that drops during the service; Exp for your Season Pass and Artifact;",0.99,,https://skycoach.gg/storage/uploads/products/vision-of-confluence1622633045_picture_item.png,Destiny 2,Destiny 2
84,,Praedyth's Revenge,"The Selected number of Praedyth's Revenge obtained on your character; If you select 5 Deepsight Rolls, we will unlock a Crafting Pattern; All other legendary and exotic loot that drops during the service; Exp for your Season Pass and Artifact;",9.49,,https://skycoach.gg/storage/uploads/products/praedyths-revenge1622633483_picture_item.png,Destiny 2,Destiny 2
85,,Found Verdict,"Buy Destiny 2 Found Verdict at Skycoach and wield this powerful legendary Shotgun in your arsenal. Known for its high impact, tight spread, and versatility, Found Verdict is perfect for close-range combat, delivering devastating damage. With our Destiny 2 Found Verdict farm service, you'll receive the following: The Selected number of Found Verdict obtained on your character; If you select 5 Deepsight Rolls, we will unlock a Crafting Pattern; All other legendary and exotic loot that drops during the service; Additional XP for your Season Pass and Artifact.",9.49,,https://skycoach.gg/storage/uploads/products/found-verdict1622633680_picture_item.png,Destiny 2,Destiny 2
86,,Corrective Measure,"Buy Destiny 2 Corrective Measure at Skycoach and enhance your firepower with this legendary Heavy Machine Gun. Known for its incredible stability and massive magazine size, Corrective Measure is a must-have for clearing waves of enemies in PvE and suppressing foes in PvP. Equip this powerhouse today and bring relentless firepower to every battle! With our Destiny 2 Corrective Measure farm service, you'll receive the following: The Selected number of Corrective Measure obtained on your character; If you select 5 Deepsight Rolls, we will unlock a Crafting Pattern; All other legendary and exotic loot that drops during the service; Additional XP for your Season Pass and Artifact.",9.49,,https://skycoach.gg/storage/uploads/products/corrective-measure1630607498_picture_item.png,Destiny 2,Destiny 2
87,,Hezen Vengeance,"Buy Destiny 2 Hezen Vengeance at Skycoach and add this Legendary Power Rocket Launcher to your collection. With its Aggressive Frame, Hezen Vengeance offers high damage output and significant recoil, delivering powerful blows that can clear out enemies in a single shot, perfect for those seeking raw power in their loadouts. With our Destiny 2 Hezen Vengeance farm service, you'll receive the following: The Selected number of Hezen Vengeance obtained on your character; If you select 5 Deepsight Rolls, we will unlock a Crafting Pattern; All other legendary and exotic loot that drops during the service; Additional XP for your Season Pass and Artifact.",9.49,,https://skycoach.gg/storage/uploads/products/hezen-vengeance1622633922_picture_item.png,Destiny 2,Destiny 2
88,,Master VoG + All 6 Timelost Weapons | FREE Secret Chests,"The Vault of Glass Raid Completed on Master Difficulty ; - Timelost Vision of Confluence , - Timelost Praedyth's Revenge , - Timelost Fatebringer , - Timelost Corrective Measure , - Timelost Hezen Vengeance - Timelost Found Verdict obtained on your account; A chance to obtain a Rare Raid Exotic - Vex Mythoclast only obtainable from the Vault of Glass Raid; The Vaultstrider Exotic Ship Obtained on your Account; All other Legendary and Exotic loot that drops during the service; Additional XP for your Season Pass and Artifact.",57.59,,https://skycoach.gg/storage/uploads/products/christmas-sale-master-vog-all-5-timelost-weapons1672258753_picture_item.png,Destiny 2,Destiny 2
89,,Vault of Glass Seal (Fatebreaker),"Buy Destiny 2 Vault of Glass boost and obtain the entire seal from scratch or finish specific Triumphs easily and guaranteed. Instead of spending many hours getting all these grindy and challenging Triumphs done, trust our PROs and forget about any hassle! You will get: The Selected Triumphs Completed; All loot that drops during the service; Exp for your Season Pass and Artifact.",0.99,,https://skycoach.gg/storage/uploads/products/vault-of-glass-seal-fatebreaker1630607419_picture_item.png,Destiny 2,Destiny 2
90,,Timelost Hezen Vengeance,"Timelost Hezen Vengeance with 2 Random Perks + Curated "" Overflow "" and "" Cluster Bombs "" Perks All Legendary and Exotic loot that might drop during the service Exp for your Season Pass and Artifact",12.99,,https://skycoach.gg/storage/uploads/products/timelost-hezen-vengeance1630616460_picture_item.png,Destiny 2,Destiny 2
91,,Vault of Glass Monthly Subscription,Four Vault of Glass Raids Completed on your Character (One raid completion Per Week on a Single Character. If you choose the “For 2 or 3 Characters” in the Extra Options you will also get Vault of Glass completed on them too at a discount). A chance to obtain Rare Raid Exotic - Vex Mythoclast only obtainable from the Vault of Glass Raid Unique and Pinnacle Vault of Glass Gear All other Legendary and Exotic loot that drops during the service Exp for your Season Pass and Artifact,32.39,,https://skycoach.gg/storage/uploads/products/vault-of-glass-monthly-subscription1636135298_picture_item.png,Destiny 2,Destiny 2
92,,Weekly Rotation Vex Mythoclast,"The Vex Mythoclast Weekly Rotation Exotic Runs; (if you want a guaranteed Vex Mythoclast, check out the Vex Mythoclast Guaranteed offer ) All unique Vault of Glass Gear that drops during the service; (if you also need a specific legendary weapon from the Vault of Glass, you can check out our legendary raid weapon services) All other Legendary and Exotic loot that drops during the service; Experience for your Season Pass and Artifact Level.",0.89,,https://skycoach.gg/storage/uploads/products/weekly-rotation-vex-mythoclast1657718367_picture_item.png,Destiny 2,Destiny 2
93,,Flawless Vault of Glass,"Buy Destiny 2 Flawless Vault of Glass boost at Skycoach and complete this legendary raid without a single death. Our expert team will guide you to a flawless run, unlocking exclusive Triumphs, powerful raid gear, and the prestige of mastering one of Destiny 2’s most iconic challenges. With our Destiny 2 Flawless Vault of Glass carry service, you'll receive the following: The Vault of Glass Raid Flawless Completion; Triumph for the Flawless Raid Completion; Flawless badge on raid.report; All Legendary and Exotic Loot that might drop during the service; Experience for your Season Pass and Artifact.",53.99,,https://skycoach.gg/storage/uploads/products/flawless-vault-of-glass1703599249_picture_item.png,Destiny 2,Destiny 2
94,,Crota's End Raid,"Buy Destiny 2 Crota's End boost to complete the raid and obtain new weapons and gear. Completing Crota's End is not an easy task, and Master difficulty is one of the biggest challenges in the entire game, but the rewards are too good to skip it entirely. Don't worry, our PRO player will help you tackle the most challenging encounters so you can enjoy the game and obtain rewards. With our Crota's End carry service, you will get the following: Crota's End Raid Completed on your character; All Legendary and Exotic Loot that might drop during the service; Additional experience for your Season Pass and Artifact.",0.89,,https://skycoach.gg/storage/uploads/products/crotas-end-raid1693671157_picture_item.png,Destiny 2,Destiny 2
95,,Crota Kill (Crota's End Last Boss),"Buy Destiny 2 Crota Kill to take down Crota with ease and earn exclusive raid rewards, pinnacle gear, and the glory of conquering this legendary encounter. Let our expert team handle the challenge while you enjoy the spoils of victory. With our Destiny 2 Crota Kill service, you'll receive the following: Crota Last Boss of Crota's End Raid defeated on your character; A chance to get Unique Raid Exotic - Necrochasm ; All Legendary and Exotic loot that might drop during the service; Additional XP for your Season Pass and Artifact.",2.99,,https://skycoach.gg/storage/uploads/products/crota-kill-crotas-end-last-boss1692108433_picture_item.png,Destiny 2,Destiny 2
96,,Necrochasm,"Buy Destiny 2 Necrochasm boost on Skycoach and easily obtain this exotic auto rifle. It is well-known within the Destiny 2 community for its great stats and origins, which go all the way back to the original Destiny game. Opt for our Necrochasm boosting now and receive the following: The Necrochasm Exotic obtained on your account; All other Legendary and Exotic loot that might drop during the service; Additional experience for your Season Pass and Artifact. Be advised that this offer includes only three attempts per week. So it might take us a while.",42.99,,https://skycoach.gg/storage/uploads/products/necrochasm1692487043_picture_item.png,Destiny 2,Destiny 2
97,,Master Crota's End,"Buy Master Crota's End boost and complete the ultimate challenge within the Crota's End raid quickly, safely, and for a reasonable price! Our professional players are some of the most efficient people in the game, so you can be sure that your order will be completed in no time! Opt for our Master Crota's End carry now and receive: Crota's End Master Raid Completed on your character; War's Lament Exotic Ship for the first completion; Adept Weapon and some Spoils of Conquest if the ""Weekly Challenge"" option is selected; All Legendary and Exotic Loot that might drop during the service; Exp for your Season Pass and Artifact. Additional Options Necrochasm Exotic Guaranteed - Enable this if you want to receive this Exotic weapon during your service.",11.99,,https://skycoach.gg/storage/uploads/products/master-crotas-end1695092987_picture_item.png,Destiny 2,Destiny 2
98,,Master Crota's End + 6 Adept Weapons Bundle,Crota's End Master Raid Completed on your character; 6 Raid Adept Weapons: - Word of Crota (Adept) ; - Fang of Ir Yut (Adept) ; - Song of Ir Yut (Adept) ; - Swordbreaker (Adept) ; - Abyss Defiant (Adept) ; - Oversoul Edict (Adept) . War's Lament Exotic Ship for the first Master Raid completion; Some Spoils of Conquest; All Legendary and Exotic Loot that might drop during the service; Exp for your Season Pass and Artifact.,38.99,,https://skycoach.gg/storage/uploads/products/master-crotas-end-6-adept-weapons-bundle1695686982_picture_item.png,Destiny 2,Destiny 2
99,,Necrochasm Catalyst,"Buy Destiny 2 Necrochasm Catalyst boost and obtain the catalyst for this Exotic gun quickly, guaranteed, and effortlessly! You will get: The Necrochasm Exotic Auto Rifle Catalyst obtained on your acount; All other Legendary and Exotic loot that might drop during the service; Exp for your Season Pass and Artifact.",8.99,,https://skycoach.gg/storage/uploads/products/necrochasm-catalyst1693576045_picture_item.webp,Destiny 2,Destiny 2
100,,Necrochasm Catalyst Masterwork,"Buy Destiny 2 Necrochasm Catalyst Masterwork and extract the maximum power out of this Exotic gun quickly, guaranteed, and effortlessly! You will get: The Necrochasm Exotic Auto Rifle Catalyst Masterworked ; Essences of the Oversoul collected; All other Legendary and Exotic loot that might drop during the service; Exp for your Season Pass and Artifact.",40.99,,https://skycoach.gg/storage/uploads/products/necrochasm-catalyst-masterwork1694134373_picture_item.webp,Destiny 2,Destiny 2
101,,Flawless Crota's End,"Buy Destiny 2 Flawless Crota's End boosting at Skycoach and conquer this iconic raid without a single death. Our professional team will guide you through every encounter flawlessly, securing exclusive rewards, Triumphs, and the prestigious Flawless completion for your Guardian. With our Destiny 2 Flawless Crota's End boost service, you'll receive the following: The Crota's End Raid Flawless Completion; Triumph for the Flawless Raid Completion; All Legendary and Exotic Loot that might drop during the service; Additional XP for your Season Pass and Artifact.",36.99,,https://skycoach.gg/storage/uploads/products/flawless-crotas-end1692673910_picture_item.webp,Destiny 2,Destiny 2
102,,Word of Crota Farm,"The Selected number of Word of Crota obtained on your account; Crota's End Encounters completion; All other Legendary and Exotic loot that drops during the service; Exp for your Season Pass and Artifact. Buy Destiny 2 Word of Crota Farm service and enhance your collection with the coveted D2 Word of Crota Hand Cannon, obtained exclusively from the Crota's End Raid, during the Season of the Witch. The Word of Crota features an impressive perk pool, with the most desirable rolls being Dragonfly + Sword Logic with their elemental damage explosion and bonus damage after final blows. You can also purchase Word of Crota Deepsight Version farm in case you want to unlock the gun's crafting pattern - just select the corresponding option. Trust our PROs to farm this gun for you and save you valuable time. The price is fair as usual .",7.89,,https://skycoach.gg/storage/uploads/products/word-of-crota-farm1694214043_picture_item.webp,Destiny 2,Destiny 2
103,,Fang Of Ir Yut Farm,"Buy Destiny 2 Fang Of Ir Yut Farm service and enhance your collection with the coveted D2 Fang Of Ir Yut Scout Rifle, obtained exclusively from the Crota's End Raid, during the Season of the Witch. The Fang Of Ir Yut features an impressive perk pool, with the most desirable rolls being Rewind Rounds + Sword Logic with their fast reload and bonus damage after final blows. With our Destiny 2 Fang Of Ir Yut farming, you'll receive the following: The Selected number of Fang Of Ir Yut obtained on your account; Crota's End Encounters completion; All other Legendary and Exotic loot that drops during the service; Additional XP for your Season Pass and Artifact. You can also purchase Fang Of Ir Yut Deepsight Version farm in case you want to unlock the gun's crafting pattern - just select the corresponding option. Trust our PROs to farm this gun for you and save you valuable time. The price is fair as usual.",7.89,,https://skycoach.gg/storage/uploads/products/fang-of-ir-yut-farm1694215409_picture_item.webp,Destiny 2,Destiny 2
