service_id,game_id,name,description,price_per_unit,sale_price,icon_url,category,game_name
181,,Ancient Gospel,"Buy Ancient Gospel legendary Destiny 2 Hand Cannon now. It's a 140 RPM precision frame hand cannon known for its accuracy and stability. With this weapon service, you will get: The selected number of Random Rolls or Deepsight Rolls; Ancient Gospel obtained on your character; All other Legendary and Exotic loot that drops during the Ancient Gospel farm service; Additional XP for your Season Pass and Artifact.",13.49,,https://skycoach.gg/storage/uploads/products/ancient-gospel1621890657_picture_item.png,Destiny 2,Destiny 2
182,,Reckless Oracle,"Buy Reckless Oracle legendary Destiny 2 Auto Rifle now. It is known for its solid handling and versatility in PvE and PvP activities due to its stability and good perk combinations. With this weapon service, you will get: The selected number of Random Rolls or Deepsight Rolls Reckless Oracle obtained on your character All other Legendary and Exotic loot that drops during the service Exp for your Season Pass and Artifact",13.49,,https://skycoach.gg/storage/uploads/products/reckless-oracle1621890804_picture_item.png,Destiny 2,Destiny 2
183,,Omniscient Eye,"Buy Omniscient Eye Legendary Destiny 2 Sniper Rifle now. It’s a rapid-fire frame sniper, meaning it has a faster fire rate and slightly lower damage per shot, making it ideal for quick follow-up shots. With this weapon service, you will get: The selected number of Random Rolls or Deepsight Rolls; The Selected number of Omniscient Eye obtained on your character; All other Legendary and Exotic loot that drops during the service; Exp for your Season Pass and Artifact.",13.49,,https://skycoach.gg/storage/uploads/products/omniscient-eye1621890948_picture_item.png,Destiny 2,Destiny 2
184,,Accrued Redemption,"Buy Accrued Redemption, a legendary Destiny 2 Bow, at Skycoach. It’s a precision-frame bow known for its accuracy and power. The weapon is particularly favored by players who enjoy using bows in both PvE and PvP activities due to its reliable handling, draw time, and perk combinations. With this weapon service, you will get: The selected number of Random Rolls or Deepsight Rolls; A ccrued Redemption obtained on your character; All other Legendary and Exotic loot that drops during the service; Additional XP for your Season Pass and Artifact.",13.49,,https://skycoach.gg/storage/uploads/products/accrued-redemption1621891135_picture_item.png,Destiny 2,Destiny 2
185,,Prophet of Doom,"Buy Prophet of Doom legendary Destiny 2 Shotgun now. It's an aggressive frame shotgun, meaning it deals high damage with a slower rate of fire, perfect for close-range combat. With this weapon service, you will get: The selected number of Random Rolls or Deepsight Rolls The Selected number of Prophet of Doom obtained on your character All other Legendary and Exotic loot that drops during the service Exp for your Season Pass and Artifact",13.49,,https://skycoach.gg/storage/uploads/products/prophet-of-doom1621891487_picture_item.png,Destiny 2,Destiny 2
186,,Zealot's Reward,"Buy Zealot's Reward legendary Destiny 2 fusion rifle now. It's a rapid-fire frame weapon with a faster charge time and fires multiple projectiles in quick succession. With this weapon service, you will get: The selected number of Random Rolls or Deepsight Rolls Zealot's Reward obtained on your character All other Legendary and Exotic loot that drops during the service Exp for your Season Pass and Artifact",13.49,,https://skycoach.gg/storage/uploads/products/zealots-reward1621891638_picture_item.png,Destiny 2,Destiny 2
187,,Garden of Salvation Seal (Enlightened),"Buy Destiny 2 Garden of Salvation Seal Boosting at Skycoach to unlock this prestigious raid title quickly and effortlessly. Our expert team will help you complete all required Triumphs, showcasing your mastery of the Garden of Salvation raid and earning the Enlightened title for your Guardian. With our Destiny 2 Garden of Salvation Seal (Enlightened) Boost service, you'll receive the following: The Selected Triumphs Completed; All loot that drops during the service; Additional XP for your Season Pass and Artifact.",0.89,,https://skycoach.gg/storage/uploads/products/garden-of-salvation-seal-enlightened1622086097_picture_item.png,Destiny 2,Destiny 2
188,,Flawless Garden of Salvation,"Buy Destiny 2 Flawless Garden of Salvation carry at Skycoach and complete this challenging raid without a single death. Our professional team will guide you to a flawless run, unlocking exclusive Triumphs, powerful raid gear, and the prestige of flawless completion for your Guardian. With our Destiny 2 Flawless Garden of Salvation boost service, you'll receive the following: The Garden of Salvation Raid Flawless Completion; Triumph for the Flawless Raid Completion; Flawless badge on raid.report; All Legendary and Exotic Loot that might drop during the service; Experience for your Season Pass and Artifact.",38.06,,https://skycoach.gg/storage/uploads/products/flawless-garden-of-salvation1703598818_picture_item.png,Destiny 2,Destiny 2
189,,Garden Patterns Bundle,Get the Patterns and craft the enhanced God Rolls with new and reprised perks. We will farm the Deepsight rolls (5/5) for every weapon in the Garden of Salvation raid to obtain the following weapon Patterns: Sacred Provenance Pulse Rifle; Ancient Gospel Hand Cannon; Reckless Oracle Auto Rifle; Omniscient Eye Sniper Rifle; Accrued Redemption Bow; Prophet of Doom Shotgun; Zealot's Reward Fusion Rifle.,345.99,,https://skycoach.gg/storage/uploads/products/garden-patterns-bundle1732695909_picture_item.png,Destiny 2,Destiny 2
190,,Master Vow of the Disciple Raid,"Buy Destiny 2 Master Vow of the Disciple boost and get this raid flawlessly completed quickly, guaranteed, and effortlessly! You will get: The Vow of the Disciple Raid Completed on Master Difficulty; Gouging Light Exotic Sparrow Obtained on your Account; A chance to get unique Raid Exotic - Collective Obligation only obtainable from the Vow of the Disciple Raid; Unique Pinnacle Vow of the Disciple Raid gear (Adept Weapons available with the Weekly Master Challenge option); All Legendary and Exotic loot that might drop during the service; Exp for your Season Pass and Artifact.",14.99,,https://skycoach.gg/storage/uploads/products/master-vow-of-the-disciple-raid1650300302_picture_item.png,Destiny 2,Destiny 2
191,,Vow of the Disciple Raid,The Vow of the Disciple Raid completed on your character A chance to get unique Raid Exotic - Collective Obligation only obtainable from the Vow of the Disciple Raid Unqiue Pinnacle Vow of the Disciple Raid gear All other Legendary and Exotic Loot that might drop during the service Exp for your Season Pass and Artifact,7.99,,https://skycoach.gg/storage/uploads/products/vow-of-the-disciple-raid1647027449_picture_item.png,Destiny 2,Destiny 2
192,,Collective Obligation,"Buy Destiny 2 Collective Obligation at Skycoach and wield one of the most unique Exotic Pulse Rifles in the game. Perfectly tailored for Void builds, this weapon lets you absorb and reapply debuffs like Weaken and Volatile, giving you unparalleled control over the battlefield. Add Collective Obligation to your in-game arsenal and redefine combat strategy! With Destiny 2 Collective Obligation farm service by Skycoach, you'll receive the following: The Collective Obligation Exotic Pulse Rifle obtained on your account; All unique Vow of the Disciple raid loot that drops during the service; All other Legendary and Exotic loot that might drop during the service; Additional XP for your Season Pass and Artifact.",31.99,,https://skycoach.gg/storage/uploads/products/collective-obligation1647172754_picture_item.png,Destiny 2,Destiny 2
193,,Rhulk Kill (Vow of the Disciple Last Boss),Rhulk Last Boss of Vow of the Disciple Raid defeated on your character A chance to get unique Raid Exotic - Collective Obligation All Legendary and Exotic Loot that might drop during the service Exp for your Season Pass and Artifact,4.49,,https://skycoach.gg/storage/uploads/products/rhulk-kill-vow-of-the-disciple-last-boss1647027642_picture_item.png,Destiny 2,Destiny 2
194,,Insidious,"Buy Destiny 2 Insidious at Skycoach and take advantage of this legendary Pulse Rifle. Featuring a powerful four-round burst and a solid recoil pattern, Insidious is ideal for delivering high-impact damage at mid-range. With its relatively high range and decent stability, it ensures reliable performance in most combat situations, making it a vital addition to your arsenal. With our Destiny 2 Insidious farm service, you'll receive the following: The selected number of Insidious obtained on your character (If you need Info about Rolls with a Guaranteed Perk as well as God Rolls, then you should check out the More Info section) All other Legendary and Exotic loot that drops during the service Additional XP for your Season Pass and Artifact",14.39,,https://skycoach.gg/storage/uploads/products/insidious1646669307_picture_item.png,Destiny 2,Destiny 2
195,,Submission,"The Selected number of Submission obtained on your character (If you need Info about Rolls with a Guaranteed Perk as well as God Rolls, then you should check out the More Info section) All other Legendary and Exotic loot that drops during the service Exp for your Season Pass and Artifact",14.39,,https://skycoach.gg/storage/uploads/products/submission1646669377_picture_item.png,Destiny 2,Destiny 2
196,,Deliverance,"Buy Destiny 2 Deliverance at Skycoach and easily obtain this legendary Fusion Rifle. This powerful weapon from the Vow of the Disciple Raid offers a deadly mix of precision and utility. As the first Stasis-powered Fusion Rifle, Deliverance provides unique versatility in both PvE and PvP scenarios. With its impressive stats and potential for perks like Demolitionist, Adrenaline Junkie, or Chill Clip, it’s a must-have for any Guardian looking to maximize their arsenal. With our Destiny 2 Deliverance farm service, you'll receive the following: The Selected number of Deliverance obtained on your character; (If you need Info about Rolls with a Guaranteed Perk as well as God Rolls, then you should check out the More Info section) All other Legendary and Exotic loot that drops during the service; Experience for your Season Pass and Artifact.",14.39,,https://skycoach.gg/storage/uploads/products/deliverance1646669419_picture_item.png,Destiny 2,Destiny 2
197,,Lubrae's Ruin,"Buy Destiny 2 Lubrae's Ruin boost and obtain this powerful Legendary Glaive quickly, guaranteed, and effortlessly! You will get: The Selected number of Lubrae's Ruin obtained on your character; All other Legendary and Exotic loot that drops during the service; Exp for your Season Pass and Artifact.",14.39,,https://skycoach.gg/storage/uploads/products/lubraes-ruin1646669460_picture_item.png,Destiny 2,Destiny 2
198,,Cataclysmic,"Buy Destiny 2 Cataclysmic at Skycoach and equip one of the most powerful Fusion Rifles in the game. With high impact, precision, and fast charge time, it's perfect for both PvE and PvP, delivering devastating damage in any encounter. Don't miss out on this top-tier weapon – get your hands on the Cataclysmic and dominate your enemies today! With our Destiny 2 Cataclysmic farm service, you'll receive the following: The selected number of Cataclysmic obtained on your character (If you need Info about Rolls with a Guaranteed Perk as well as God Rolls, then you should check out the More Info section) All other Legendary and Exotic loot that drops during the service Additional XP for your Season Pass and Artifact",14.39,,https://skycoach.gg/storage/uploads/products/cataclysmic1646669559_picture_item.png,Destiny 2,Destiny 2
199,,Vow of the Disciple Monthly Subscription,Four Vow of the Disciple Raids completed on your character A chance to get unique Raid Exotic - Collective Obligation only obtainable from the Vow of the Disciple Raid Unqiue Pinnacle Vow of the Disciple Raid gear All other Legendary and Exotic Loot that might drop during the service Exp for your Season Pass and Artifact,28.79,,https://skycoach.gg/storage/uploads/products/vow-of-the-disciple-monthly-subscription1647027991_picture_item.png,Destiny 2,Destiny 2
200,,Flawless Vow of the Disciple Raid,"Buy Destiny 2 Flawless Vow of the Disciple Raid boost at Skycoach and complete this challenging raid without a single death. Our professional team will guide you through every encounter, unlocking exclusive Triumphs, powerful raid gear, and the prestige of achieving flawless completion in one of Destiny 2's most intense and rewarding raids. With our Destiny 2 Flawless Vow of the Disciple Raid carry service, you'll receive the following: Flawless Vow of the Disciple Raid completed on your character; A chance to get unique Raid Exotic - Collective Obligation only obtainable from the Vow of the Disciple Raid; Unique Pinnacle Vow of the Disciple Raid gear; All Legendary and Exotic Loot that might drop during the service; Additional XP for your Season Pass and Artifact.",54.99,,https://skycoach.gg/storage/uploads/products/flawless-vow-of-the-disciple-raid1647028022_picture_item.png,Destiny 2,Destiny 2
201,,Vow of the Disciple Seal (Disciple-Slayer),The Selected Triumphs Completed All loot that drops during the service Exp for your Season Pass and Artifact,12.89,,https://skycoach.gg/storage/uploads/products/vow-of-the-disciple-seal-disciple-slayer1646955745_picture_item.png,Destiny 2,Destiny 2
202,,Adept Insidious,"Buy Destiny 2 Adept Insidious at Skycoach and easily obtain the desired amount of this legendary Pulse Rifle. Let our PRO players handle the challenges and grind so you can focus on enjoying the game. With this Adept Insidious farming service, you'll be guaranteed to receive the following: The Selected number of Adept Insidious obtained on your character; (If you need Info about Rolls with a Guaranteed Perk as well as God Rolls, then you should check out the More Info section) All other Legendary and Exotic loot that drops during the service; Additional XP for your Season Pass and Artifact.",13.99,,https://skycoach.gg/storage/uploads/products/adept-insidious1656327026_picture_item.png,Destiny 2,Destiny 2
203,,Adept Submission,"Buy Adept Submission, a legendary Submachine Gun, at Skycoach. Don't miss out on the chance to obtain this unique weapon quickly and effortlessly as many times as you need. With our Adept Submission farm service, you'll receive the following: The Selected number of Adept Submission obtained on your character; (If you need Info about Rolls with a Guaranteed Perk as well as God Rolls, then you should check out the More Info section) All other Legendary and Exotic loot that drops during the service; Additional XP for your Season Pass and Artifact.",13.99,,https://skycoach.gg/storage/uploads/products/adept-submission1656326980_picture_item.png,Destiny 2,Destiny 2
204,,Adept Deliverance,"Buy Adept Deliverance, a long-range legendary Fusion Rifle. Don't miss out on the chance to acquire this powerful weapon quickly and effortlessly. With Adept Deliverance farming service by Skycoach, you'll receive the following: The Selected number of Adept Deliverance obtained on your character; (If you need Info about Rolls with a Guaranteed Perk as well as God Rolls, then you should check out the More Info section) All other Legendary and Exotic loot that drops during the service; Additional XP for your Season Pass and Artifact.",13.99,,https://skycoach.gg/storage/uploads/products/adept-deliverance1656327073_picture_item.png,Destiny 2,Destiny 2
205,,Adept Lubrae's Ruin,"Buy Destiny 2 Adept Lubrae's Ruin at Skycoach and easily obtain this Legendary Glaive. Our PRO players will help you get this powerful weapon with a unique ability to generate energy on dealing with ranged damage. Opt for our Adept Lubrae's Ruin Farm service now and receive the following: The Selected number of Adept Lubrae's Ruin obtained on your character; (If you need Info about Rolls with a Guaranteed Perk as well as God Rolls, then you should check out the More Info section) All other Legendary and Exotic loot that drops during the service; Additional XP for your Season Pass and Artifact.",13.99,,https://skycoach.gg/storage/uploads/products/adept-lubraes-ruin1656327120_picture_item.png,Destiny 2,Destiny 2
206,,Adept Forbearance,"Buy Adept Forbearance, a legendary Grenade Launcher, at Skycoach. Don't miss out on the chance to obtain this powerful weapon quickly and effortlessly. With our Adept Forbearance farming service, you'll receive the following: The Selected number of Adept Forbearance obtained on your character; (If you need Info about Rolls with a Guaranteed Perk as well as God Rolls, then you should check out the More Info section) All other Legendary and Exotic loot that drops during the service; Additional XP for your Season Pass and Artifact.",11.33,,https://skycoach.gg/storage/uploads/products/adept-forbearance1656554186_picture_item.png,Destiny 2,Destiny 2
207,,Adept Cataclysmic,"Buy Destiny 2 Adept Cataclysmic with God Roll options and easily obtain this legendary Linear Fusion Rifle for your in-game collection. Our PRO players will handle the tedious farming process and provide the best results. With our Adept Cataclysmic farm service, you will get the following: The Selected number of Adept Cataclysmic obtained on your character; (If you need Info about Rolls with a Guaranteed Perk as well as God Rolls, then you should check out the More Info section) All other Legendary and Exotic loot that drops during the service; Additional XP for your Season Pass and Artifact.",13.99,,https://skycoach.gg/storage/uploads/products/adept-cataclysmic1656554209_picture_item.png,Destiny 2,Destiny 2
208,,Vow of the Disciple Raid Armor Set,The Selected Armor Pieces obtained on your character Spoils of Conquest All other Legendary and Exotic loot that drops during the service Exp for your Season Pass and Artifact,0.78,,https://skycoach.gg/storage/uploads/products/vow-of-the-disciple-raid-armor-set1648589764_picture_item.png,Destiny 2,Destiny 2
209,,Weekly Rotation Collective Obligation,"The Collective Obligation Weekly Rotation Exotic Runs; (if you want a guaranteed Collective Obligation, then you should our other offer ) All unique Vow of the Disciple loot that drops during the service; (if you also need a specific legendary weapon from the Vault of Glass, you can check out our legendary raid weapon services) All other Legendary and Exotic loot that drops during the service; Experience for your Season Pass and Artifact Level.",8.00,,https://skycoach.gg/storage/uploads/products/weekly-rotation-collective-obligation1663067484_picture_item.png,Destiny 2,Destiny 2
210,,Sundered Doctrine Dungeon,"Buy Sundered Doctrine Dungeon carry service in Destiny 2 to complete the Episode Heresy pinnacle activity. Get new, unique dungeon weapons, armor, and Triumphs. Choose from several completion options depending on your goals. With our Destiny 2 Sundered Doctrine dungeon boost, you will get: The Contest Mode Emblem and dungeon Exotic weapon (if the Contest Mode option is selected); New unique dungeon weapons & armor; A chance to get the dungeon Exotic weapon; All other Legendary and Exotic loot that might drop during the service; Experience for your Season Pass and Artifact.",5.99,,https://skycoach.gg/storage/uploads/products/sundered-doctrine-dungeon1738856330_picture_item.png,Destiny 2,Destiny 2
211,,Prophecy,The Prophecy Dungeon Completion on your character; Some unique Prophecy Weapons and Armor exclusive to this dungeon; All other Legendary and Exotic loot that drops during the service; Exp for your Season Pass and Artifact;,4.99,,https://skycoach.gg/storage/uploads/products/prophecy1621634849_picture_item.png,Destiny 2,Destiny 2
212,,Ice Breaker,"Buy the Ice Breaker Exotic Sniper Rifle in Destiny 2. This beloved weapon from the original game found its way back to Guardian's loadout and became one of the best in slot PvP weapons. With our Ice Breaker farming service, you will get: Ice Breaker on your account guaranteed; Some dungeon weapons and armor; All other Legendary and Exotic loot that might drop during the service; Experience for your Season Pass and Artifact; To get the exotic, our Destiny pro players will farm the dungeon every week until Ice Breaker drops.",44.99,,https://skycoach.gg/storage/uploads/products/ice-breaker1728980734_picture_item.png,Destiny 2,Destiny 2
213,,Finality's Auger Catalyst,Buy Finality's Auger Catalyst in Destiny 2 to boost your exotic Linear Fusion and access the Bait and Switch perk to substantially increase your damage. The Finality's Auger Catalyst obtained on your account; Catalyst Masterworked (with the “Catalyst Masterwork” extra option); The Drowning Labyrinth quest completed; All other Legendary and Exotic loot that might drop during the service; Experience for your Season Pass and Artifact.,15.99,,https://skycoach.gg/storage/uploads/products/finalitys-auger-catalyst1739967578_picture_item.png,Destiny 2,Destiny 2
214,,Finality's Auger,"Buy the Finality's Auger Exotic Linear Fusion Rifle in Destiny 2. It has some unique perks and mechanics like deploying a Ruinscribe Turret which will automatically shoot at nearby targets. You can switch between two firing modes for maximum efficiency and boost your DPS in any endgame activity. With our Finality's Auger farming service, you will get: Finality's Auger on your account guaranteed; Some dungeon weapons and armor; All other Legendary and Exotic loot that might drop during the service; Experience for your Season Pass and Artifact; To get the exotic, our Destiny pro players will farm the dungeon every week until Finality's Auger drops.",36.99,,https://skycoach.gg/storage/uploads/products/finalitys-auger1738855970_picture_item.png,Destiny 2,Destiny 2
215,,Buried Bloodline,"Buy Destiny 2 Buried Bloodline boost and easily obtain this exotic rocket sidearm. It is one of the fan's favorite exotic weapons for a reason. It is a cool-looking sidearm with great stats, but the drop rate is extremely low. It's best used in PvE, but is also very decent in PvP as well. Expand your Destiny 2 arsenal quickly and effortlessly with Skycoach and get the following: The Buried Bloodline Exotic Sidearm obtained on your account; Unique Warlord's Ruin loot; All other Legendary and Exotic loot that might drop during the Buried Bloodline boosting service; Additional XP for your Season Pass and Artifact.",17.99,,https://skycoach.gg/storage/uploads/products/buried-bloodline1701466135_picture_item.png,Destiny 2,Destiny 2
216,,Vesper's Host Armor,"Buy Vesper's Host Armor Set and unlock stunning armor from the Vesper’s Host Dungeon. Our PROs will conquer the dungeon for you during the Spacewalk Suit boost, securing valuable loot. Feel free to reach out to us and get started now. What will you get with our service: The Selected Armor Pieces obtained on your character; New Vesper’s Host Dungeon loot; All other Legendary and Exotic loot that might drop during the service; Experience for your Season Pass and Artifact. Get our cheap Vesper's Host Armor Set for sale now and let our players handle the grind on your behalf, saving you time and nerves.",0.99,,https://skycoach.gg/storage/uploads/products/vespers-host-armor1728918186_picture_item.png,Destiny 2,Destiny 2
217,,Sundered Doctrine Armor,"Buy Sundered Doctrine Armor Set and unlock a crispy-looking gear from the dungeon. Our PROs will complete the activity for you, securing valuable loot. Feel free to reach out to us and get started now. What will you get with the Flain armor boost: The Selected Armor pieces obtained on your character; New Sundered Doctrine dungeon loot; All other Legendary and Exotic loot that might drop during the service; Experience for your Season Pass and Artifact. Get our cheap Flain Armor Set for sale now and let our players handle the grind on your behalf, saving you time and nerves.",0.99,,https://skycoach.gg/storage/uploads/products/sundered-doctrine-armor1739967733_picture_item.png,Destiny 2,Destiny 2
218,,Master Duality Dungeon,"Buy Destiny 2 Master Duality boost and get the dungeon flawlessly completed quickly, guaranteed, and effortlessly! You will get: The Master Duality Dungeon completed on your Character; (if you choose multiple characters with the “extra options,” then they will also receive a discount on your Duality Dungeon Completion) A chance to get Dungeon Exotic - Heartshadow only obtainable from the Duality Dungeon; Unique Dungeon Weapons and Armor; All Legendary and Exotic Loot that might drop during the service; Exp for your Season Pass and Artifact.",0.99,,https://skycoach.gg/storage/uploads/products/master-duality-dungeon1655052496_picture_item.png,Destiny 2,Destiny 2
219,,Warlord's Ruin Dungeon,"Buy Destiny 2 Warlord's Ruin boost to complete the dungeon and obtain new weapons and gear quickly and effortlessly. Leave it to professional players to face challenging encounters and achieve your in-game goals. With our Warlord's Ruin carry service, you will get: The Warlord's Ruin Dungeon completed; Emblem for Solo Flawless completion (if selected); New Unique Dungeon Weapons & Gear; A chance to obtain a brand-new Dungeon Exotic Weapon ; All other Legendary and Exotic loot that might drop during the service; Experience for your Season Pass and Artifact.",4.99,,https://skycoach.gg/storage/uploads/products/warlords-ruin-dungeon1701794872_picture_item.png,Destiny 2,Destiny 2
