service_id,game_id,name,description,price_per_unit,sale_price,icon_url,category,game_name
143,,Hmmm… can't reach this page,,,,,Destiny 2,Destiny 2
144,,Harrowed Zaouli's Bane Farm,"Buy Destiny 2 Harrowed Zaouli's Bane at Skycoach and instantly add this legendary Solar Hand Cannon to your collection. With its Adaptive Frame, Zaouli’s Bane offers a balanced grip, reliable handling, and strong damage output, making it a top-tier choice for both PvE and PvP engagements. With our Destiny 2 Harrowed Zaouli's Bane farm service, you'll receive the following: The Selected number of Harrowed Zaouli's Bane obtained on your character; (If you need Info about Rolls with a Guaranteed Perk as well as God Rolls, then you should check out the More Info section) All other Legendary and Exotic loot that drops during the service; Additional XP for your Season Pass and Artifact.",17.99,,https://skycoach.gg/storage/uploads/products/harrowed-zaoulis-bane1663072741_picture_item.png,Destiny 2,Destiny 2
145,,Harrowed Midha's Reckoning Farm,"Buy Destiny 2 Harrowed Midha's Reckoning and obtain this powerful Legendary Rifle quickly, guaranteed, and effortlessly! You will get: The Selected number of Harrowed Midha's Reckoning obtained on your character; (If you need Info about Rolls with a Guaranteed Perk as well as God Rolls, then you should check out the More Info section) All other Legendary and Exotic loot that drops during the service; Exp for your Season Pass and Artifact.",17.99,,https://skycoach.gg/storage/uploads/products/midhas-reckoning1663080092_picture_item.png,Destiny 2,Destiny 2
146,,Harrowed Doom of Chelchis Farm,"Buy Destiny 2 Harrowed Doom of Chelchis on Skycoach to secure this legendary Energy Scout Rifle. Featuring a Precision Frame, it delivers a reliably vertical recoil pattern, making it perfect for long-range engagements with consistent accuracy and powerful shots in both PvE and PvP activities. With our Destiny 2 Harrowed Doom of Chelchis farm service, you'll receive the following: The Selected number of Harrowed Doom of Chelchis obtained on your character; (If you need Info about Rolls with a Guaranteed Perk as well as God Rolls, then you should check out the More Info section) All other Legendary and Exotic loot that drops during the service; Additional XP for your Season Pass and Artifact.",17.99,,https://skycoach.gg/storage/uploads/products/harrowed-doom-of-chelchis1663083411_picture_item.png,Destiny 2,Destiny 2
147,,Harrowed Defiance of Yasmin Farm,"Opt in to our Destiny 2 Harrowed Defiance of Yasmin farm service and quickly add this powerful Legendary Sniper Rifle to your collection. Known for its precision and high-impact rounds, this weapon excels at long-range engagements and will enhance your PvE and PvP loadout with optimal perks. Buy Destiny 2 Harrowed Defiance of Yasmin on Skycoach today, and receive the following: The Selected number of Harrowed Defiance of Yasmin obtained on your character; (If you need Info about Rolls with a Guaranteed Perk as well as God Rolls, then you should check out the More Info section) All other Legendary and Exotic loot that drops during the service; Additional XP for your Season Pass and Artifact.",17.99,,https://skycoach.gg/storage/uploads/products/harrowed-defiance-of-yasmin1663156718_picture_item.png,Destiny 2,Destiny 2
148,,Harrowed Quilim's Terminus Farm,"Buy Destiny 2 Harrowed Quilim's Terminus on Skycoach to add this legendary Stasis Power Machine Gun. Featuring a High-Impact Frame, it delivers slow, high-damage shots that are more accurate when stationary or moving slowly, making it ideal for precision control and powerful damage output With our Destiny 2 Harrowed Quilim's Terminus farm service, you'll receive the following: The Selected number of Harrowed Quilim's Terminus obtained on your character; (If you need Info about Rolls with a Guaranteed Perk as well as God Rolls, then you should check out the More Info section) All other Legendary and Exotic loot that drops during the service; Additional XP for your Season Pass and Artifact.",17.99,,https://skycoach.gg/storage/uploads/products/harrowed-quilims-terminus1663158753_picture_item.png,Destiny 2,Destiny 2
149,,Harrowed Smite of Merain Farm,"Buy Destiny 2 Harrowed Smite of Merain on Skycoach to get your hands on this legendary Kinetic Pulse Rifle. Featuring an Adaptive Frame, it offers a balanced and reliable performance with a sturdy grip, making it an excellent choice for both sustained fire and precision. With our Destiny 2 Harrowed Smite of Merain farm service, you'll receive the following: The Selected number of Harrowed Smite of Merain obtained on your character; (If you need Info about Rolls with a Guaranteed Perk as well as God Rolls, then you should check out the More Info section) All other Legendary and Exotic loot that drops during the service; Additional XP for your Season Pass and Artifact.",17.99,,https://skycoach.gg/storage/uploads/products/harrowed-smite-of-merain1663160501_picture_item.png,Destiny 2,Destiny 2
150,,Flawless King's Fall,"Buy Destiny 2 Flawless King's Fall boosting at Skycoach and conquer this iconic raid without a single death. Our expert team will ensure a flawless King's Fall run, unlocking exclusive Triumphs, powerful raid gear, and the prestige of flawless completion for your Guardian. With our Destiny 2 Flawless King's Fall carry service, you'll receive the following: The King's Fall Raid Flawless Completion; Triumph for the Flawless Raid Completion; Flawless badge on raid.report; All Legendary and Exotic Loot that might drop during the service; Experience for your Season Pass and Artifact.",62.99,,https://skycoach.gg/storage/uploads/products/flawless-kings-fall1703598252_picture_item.png,Destiny 2,Destiny 2
151,,Touch of Malice,The Touch of Malice Exotic obtained on your account; Unique King's Fall Gear; All other Legendary and Exotic loot that might drop during the service; Exp for your Season Pass and Artifact. Be advised that this offer includes only three attempts per week. So it might take us a while.,31.99,,https://skycoach.gg/storage/uploads/products/touch-of-malice1661529280_picture_item.png,Destiny 2,Destiny 2
152,,King's Fall Raid Armor Set,"Buy Destiny 2 King's Fall Raid Armor Set boost and obtain this Legendary Weapon quickly, guaranteed, and effortlessly! You will get: The Selected Armor Pieces obtained on your character; Season of Plunder Loot; All other Legendary and Exotic loot that might drop during the service; Exp for your Season Pass and Artifact.",35.89,,https://skycoach.gg/storage/uploads/products/kings-fall-raid-armor-set1661893420_picture_item.png,Destiny 2,Destiny 2
153,,King's Fall Raid Coaching,"Buy Destiny 2 King's Fall Raid Coaching and complete this tricky raid with the help of top PROs quickly, guaranteed, and effortlessly! You will get: The King's Fall Legacy Raid fully explained to you by our pros. (Offer includes one run) A chance to obtain Rare Raid Exotics. Unique and Pinnacle King's Fall gear. All other Legendary and Exotic loot that drops during the service. Exp for your Season Pass and Artifact.",28.79,,https://skycoach.gg/storage/uploads/products/week-one-raid-coaching-preorder1660135542_picture_item.png,Destiny 2,Destiny 2
154,,Last Wish Raid,"Buy Destiny 2 Last Wish Raid boost to complete this raid without any problems. Choose professional assistance from Skycoach instead of grinding and effortlessly obtain all valuable raid rewards. You will get: The Last Wish Raid Completion on your Character (if you choose multiple characters within the “extra options,” then they will also receive the Last Wish Raid Completion at a discount); A chance to obtain the Rare Raid Exotic - One Thousand Voices , which you can only obtain from the Last Wish Raid; Exclusive Last Wish Gear (If you need a specific weapon, then you need to check our raid legendary weapons service and choose a random roll or a roll with a guaranteed perk that you want); Spoils of Conquest; All other Legendary and Exotic loot that drops during the service; Exp for your Season Pass and Artifact.",6.99,,https://skycoach.gg/storage/uploads/products/last-wish1621636594_picture_item.png,Destiny 2,Destiny 2
155,,Apex Predator,"Buy Destiny 2 Apex Predator, a legendary Rocket Launcher, at Skycoach. Whether you're clearing out enemy strongholds or simply showing off your collection, this weapon is an excellent addition to your in-game arsenal. With our Apex Predator farm service, you will get the following: The Selected number of Apex Predator obtained on your character (If you need Info about Rolls with a Guaranteed Perk as well as God Rolls, then you should check out the More Info section) All other Legendary and Exotic loot that drops during the service Additional XP for your Season Pass and Artifact",12.59,,https://skycoach.gg/storage/uploads/products/apex-predator1621893179_picture_item.png,Destiny 2,Destiny 2
156,,Chattering Bone,"Get your hands on the Chattering Bone in Destiny 2 at Skycoach—a Pulse Rifle that stands out for its speed and precision. Whether you're taking on challenging missions or looking for a dependable weapon to round out your collection, Chattering Bone delivers where it matters. Add this fan-favorite to your arsenal and see why it’s a top pick among Guardians. With our Destiny 2 Chattering Bone farm service, you’ll receive: The Selected number of Chattering Bone obtained on your character; (If you need Info about Rolls with a Guaranteed Perk as well as God Rolls, then you should check out the More Info section) All other Legendary and Exotic loot that drops during the service; Additional XP for your Season Pass and Artifact.",12.59,,https://skycoach.gg/storage/uploads/products/chattering-bone1621891990_picture_item.png,Destiny 2,Destiny 2
157,,Transfiguration,"The Selected number of Transfiguration obtained on your character (If you need Info about Rolls with a Guaranteed Perk as well as God Rolls, then you should check out the More Info section) All other Legendary and Exotic loot that drops during the service Exp for your Season Pass and Artifact",12.59,,https://skycoach.gg/storage/uploads/products/transfiguration1621895095_picture_item.png,Destiny 2,Destiny 2
158,,The Supremacy,"The Selected number of The Supremacy obtained on your character (If you need Info about Rolls with a Guaranteed Perk as well as God Rolls, then you should check out the More Info section) All other Legendary and Exotic loot that drops during the service Exp for your Season Pass and Artifact",12.59,,https://skycoach.gg/storage/uploads/products/the-supremacy1621891806_picture_item.png,Destiny 2,Destiny 2
159,,Tyranny of Heaven,"The Selected number of Tyranny of Heaven obtained on your character (If you need Info about Rolls with a Guaranteed Perk as well as God Rolls, then you should check out the More Info section) All other Legendary and Exotic loot that drops during the service Exp for your Season Pass and Artifact",12.59,,https://skycoach.gg/storage/uploads/products/tyranny-of-heaven1621894501_picture_item.png,Destiny 2,Destiny 2
160,,Techeun Force,"The Selected number of Techeun Force obtained on your character (If you need Info about Rolls with a Guaranteed Perk as well as God Rolls, then you should check out the More Info section) All other Legendary and Exotic loot that drops during the service Exp for your Season Pass and Artifact",12.59,,https://skycoach.gg/storage/uploads/products/techeun-force1621894733_picture_item.png,Destiny 2,Destiny 2
161,,Age-Old Bond,"Stay locked and loaded with our Destiny 2 Age-Old Bond farm service. This weapon will be a worthy addition to your arsenal and is great for both PvE and PvP battles. Don't miss out on the chance to quickly and effortlessly obtain this legendary Void auto rifle with unique features that make it a standout choice for Guardians seeking unparalleled power! Buy Age-Old Bond at Skycoach now and receive the following: The Selected number of Age-Old Bond obtained on your character; (If you need Info about Rolls with a Guaranteed Perk as well as God Rolls, then you should check out the More Info section) All other Legendary and Exotic loot that drops during the service; Additional XP for your Season Pass and Artifact",12.59,,https://skycoach.gg/storage/uploads/products/age-old-bond1621895454_picture_item.png,Destiny 2,Destiny 2
162,,Nation of Beasts,"Buy Destiny 2 Nation of Beasts and obtain this Legendary Hand Cannon quickly, guaranteed, and effortlessly! You will get: The Selected number of Nation of Beasts obtained on your character; (If you need Info about Rolls with a Guaranteed Perk as well as God Rolls, then you should check out the More Info section) All other Legendary and Exotic loot that drops during the service; Exp for your Season Pass and Artifact.",12.59,,https://skycoach.gg/storage/uploads/products/nation-of-beast1621895908_picture_item.png,Destiny 2,Destiny 2
163,,One Thousand Voices,The One Thousand Voices Exotic Fusion Rifle obtained on your Account; Exclusive Last Wish Gear If you need a Specific weapon then you need to check our raid legendary weapons service and either choose a random roll or a roll with a guaranteed perk that you want) All other Legendary and Exotic loot that drops during the service; Exp for your Season Pass and Artifact.,20.99,,https://skycoach.gg/storage/uploads/products/one-thousand-voices1630607349_picture_item.png,Destiny 2,Destiny 2
164,,Last Wish Seal (Rivensbane),"Buy Destiny 2 Last Wish Seal (Rivensbane) boost and obtain the seal by doing all Last Wish Triumphs quickly, guaranteed, and effortlessly! You will get: The Selected Triumphs Completed; All loot that drops during the service; Exp for your Season Pass and Artifact.",15.24,,https://skycoach.gg/storage/uploads/products/last-wish-seal-rivensbane1622085964_picture_item.png,Destiny 2,Destiny 2
165,,Flawless Last Wish,"Buy Destiny 2 Flawless Last Wish carry at Skycoach and complete one of the most challenging raids in the game without a single death. Achieving a flawless run unlocks exclusive Triumphs, raid gear, and the potential for rare rewards like the One Thousand Voices Exotic Fusion Rifle. With intricate mechanics, tough encounters like Shuro Chi and Riven, and stunning environments, Last Wish is a true test of skill that our professional team will guide you through seamlessly. With our Destiny 2 Flawless Last Wish boosting service, you'll receive the following: The Last Wish Raid Completion on your Character; The Petra's Run Triumph completed on your account; A chance to obtain the Rare Raid Exotic - One Thousand Voices , which you can only obtain from the Last Wish Raid; Spoils of Conquest; All other Legendary and Exotic loot that drops during the service; Additional XP for your Season Pass and Artifact.",36.99,,https://skycoach.gg/storage/uploads/products/flawless-last-wish1673538572_picture_item.png,Destiny 2,Destiny 2
166,,Weekly Rotation One Thousand Voices,"The One Thousand Voices Weekly Rotation Exotic Runs (if you want a guaranteed One Thousand Voices , then you should check our other offer) All unique Last Wish Gear that drops during the service (if you also need a specific legendary weapon from the Vault of Glass, you can check out our legendary raid weapon services) All other Legendary and Exotic loot that drops during the service Experience for your Season Pass and Artifact Level",8.00,,https://skycoach.gg/storage/uploads/products/weekly-rotation-one-thousand-voices1658240043_picture_item.png,Destiny 2,Destiny 2
167,,Deep Stone Crypt Raid,"Buy Destiny 2 Deep Stone Crypt boost to complete the raid and loot its exclusive and precious rewards the quickest and easiest way possible! You will get: The Deep Stone Crypt Raid completed on your character. (if you choose Multiple Characters within the “extra options,” then they will also receive the Deep Stone Crypt Raid Completion at a discount) A chance to obtain Rare Raid Exotic- Eyes of Tomorrow , only obtainable from the Deep Stone Crypt Raid; (you can choose “Eyes of Tomorrow Guaranteed” as an Extra option and be guaranteed to get them on your account) Unique and Pinnacle Deep Stone Crypt Gear; (If you need a specific weapon, then you need to select the “Guaranteed 1 Legendary Deep Stone Crypt Weapon Obtain” as an Extra Option) All other legendary and exotic loot drops during the service. Experience for your Season Pass and Artifact.",0.99,,https://skycoach.gg/storage/uploads/products/deep-stone-crypt-raid1621634123_picture_item.png,Destiny 2,Destiny 2
168,,Eyes of Tomorrow,"Buy Destiny 2 Eyes of Tomorrow at Skycoach and harness the power of this Exotic Rocket Launcher. With its unique tracking missiles and ability to target multiple enemies simultaneously, Eyes of Tomorrow is perfect for clearing waves in PvE and making an impact in PvP. With our Destiny 2 Eyes of Tomorrow farm service, you'll receive the following: The Eyes of Tomorrow Exotic Rocket Launcher obtained on your Account; All unique Deep Stone Crypt Gear that drops during the service (if you also need a specific legendary weapon from the Deep Stone Crypt, you can check out our legendary raid weapon services); All other Legendary and Exotic loot that drops during the service; Additional XP for your Season Pass and Artifact. Be advised that this offer includes only three attempts per week. So it might take us a while.",31.49,,https://skycoach.gg/storage/uploads/products/eyes-of-tomorrow1621635049_picture_item.png,Destiny 2,Destiny 2
169,,Bequest,"Buy Destiny 2 Bequest at Skycoach and easily obtain this legendary Sword. Unleash devastating attacks that can take down tough enemies quickly with style. This heavy sword combines raw strength with strategic finesse, perfect for dominating both PvE and PvP combat. Our Destiny 2 Bequest unlock service includes the following: The selected number of Bequest obtained on your character (If you need Info about Rolls with a Guaranteed Perk as well as God Rolls, then you should check out the More Info section) All other Legendary and Exotic loot that drops during the service Additional XP for your Season Pass and Artifact",13.49,,https://skycoach.gg/storage/uploads/products/bequest1621889066_picture_item.png,Destiny 2,Destiny 2
170,,Trustee,"The Selected number of Trustee obtained on your character (If you need Info about Rolls with a Guaranteed Perk as well as God Rolls, then you should check out the More Info section) All other Legendary and Exotic loot that drops during the service Exp for your Season Pass and Artifact",13.49,,https://skycoach.gg/storage/uploads/products/trustee1621889236_picture_item.png,Destiny 2,Destiny 2
171,,Posterity,"The Selected number of Posterity obtained on your character (If you need Info about Rolls with a Guaranteed Perk as well as God Rolls, then you should check out the More Info section) All other Legendary and Exotic loot that drops during the service Exp for your Season Pass and Artifact",13.49,,https://skycoach.gg/storage/uploads/products/posterity1621889401_picture_item.png,Destiny 2,Destiny 2
172,,Heritage,"Buy Destiny 2 Heritage at Skycoach and easily add this powerful Legendary Shotgun to your arsenal. With its Precision Frame and high-impact rounds, Heritage delivers exceptional damage and reliable performance, making it a top-tier choice for close-range combat. With our Destiny 2 Heritage farm service, you'll receive the following: The selected number of Heritage obtained on your character; (If you need Info about Rolls with a Guaranteed Perk as well as God Rolls, then you should check out the More Info section) All other Legendary and Exotic loot that drops during the service; Additional XP for your Season Pass and Artifact.",13.49,,https://skycoach.gg/storage/uploads/products/heritage1621889627_picture_item.png,Destiny 2,Destiny 2
173,,Commemoration,"Buy Destiny 2 Commemoration at Skycoach and add this Legendary Machine Gun to your arsenal. Known for its impressive stability and top-tier perk combinations, Commemoration is a standout choice for PvE activities and sustained DPS. Get your hands on this reliable weapon and dominate every encounter with ease! With our Destiny 2 Commemoration farm service, you'll receive the following: The Selected number of Commemoration obtained on your character (If you need Info about Rolls with a Guaranteed Perk as well as God Rolls, then you should check out the More Info section) All other Legendary and Exotic loot that drops during the service Additional XP for your Season Pass and Artifact",13.49,,https://skycoach.gg/storage/uploads/products/commemoration1621889785_picture_item.png,Destiny 2,Destiny 2
174,,Flawless Deep Stone Crypt,"Buy Destiny 2 Flawless Deep Stone Crypt boosting at Skycoach and complete this iconic raid without a single death. Our expert team will help you achieve a flawless run, unlocking exclusive rewards, Triumphs, and the prestige of a flawless completion for your Guardian. With our Destiny 2 Flawless Deep Stone Crypt carry service, you'll receive the following: The Deep Stone Crypt Raid Completion; The Cryptic Legacy Shader Obtained; The “Survival of the Fittest” Triumph Completed; All Legendary and Exotic Loot that might drop during the service; Additional XP for your Season Pass and Artifact.",37.99,,https://skycoach.gg/storage/uploads/products/flawless-deep-stone-crypt1621886371_picture_item.png,Destiny 2,Destiny 2
175,,Succession,"The Selected number of Succession obtained on your character (If you need Info about Rolls with a Guaranteed Perk as well as God Rolls, then you should check out the More Info section) All other Legendary and Exotic loot that drops during the service Exp for your Season Pass and Artifact",10.99,,https://skycoach.gg/storage/uploads/products/succession1621888872_picture_item.png,Destiny 2,Destiny 2
176,,Weekly Rotation Eyes of Tomorrow,"The Eyes of Tomorrow Weekly Rotation Exotic Runs; (if you want a guaranteed Eyes of Tomorrow, then you should check our other offer ) All unique Deep Stone Crypt Gear that drops during the service; (if you also need a specific legendary weapon from the Vault of Glass, you can check out our legendary raid weapon services) All other Legendary and Exotic loot that drops during the service; Experience for your Season Pass and Artifact Level.",8.00,,https://skycoach.gg/storage/uploads/products/weekly-rotation-eyes-of-tomorrow1663069588_picture_item.png,Destiny 2,Destiny 2
177,,Garden of Salvation Memento,"Buy Destiny 2 Garden of Salvation Memento to make your favorite weapons stand out. Our pro players will grind the raid for this unique animated shader, Garden of Salvation Keepsake, which looks like a Vex network grid inside your gun. Any number of mementos obtained on your account; Some raid weapons and armor; A chance to obtain red border weapon during the boost; All other Legendary and Exotic loot that drops during the service; Experience for your Season Pass and Artifact.",26.99,,https://skycoach.gg/storage/uploads/products/garden-of-salvation-memento1729160583_picture_item.png,Destiny 2,Destiny 2
178,,Garden of Salvation,"Buy Destiny 2 Garden of Salvation Boosting at Skycoach and complete this challenging Vex-themed raid with ease. Our professional team will guide you through every encounter, earning you exclusive raid gear, powerful weapons, Triumphs, and a chance at the Divinity Exotic Trace Rifle. With our Destiny 2 Garden of Salvation Boost Service, you'll receive the following: The Garden of Salvation Raid Completed on your Character (if you choose multiple characters within the “extra options”, then they will also receive the Garden of Salvation Raid Completion at a discount); Exclusive Garden of Salvation Gear (If you need a specific weapon, then you need to check our raid legendary weapons service and either choose a random roll or a roll with a guaranteed perk that you want); Spoils of Conquest ; All other Legendary and Exotic loot that drops during the service; Additional XP for your Season Pass and Artifact.",5.99,,https://skycoach.gg/storage/uploads/products/garden-of-salvation1621636674_picture_item.png,Destiny 2,Destiny 2
179,,Divinity,"Buy Destiny 2 Divinity, the Exotic Trace Rifle, on Skycoach to harness the unparalleled might. This weapon amplifies damage and locks down foes, making it a must-have for any Guardian ready to dominate raids and high-level content. With our Destiny 2 Divinity farm service, you'll receive the following: The Divinity Exotic Trace Rifle obtained on your Account (if you have already made some progress, then you can choose just the quest steps that you need, like the final step-raid puzzle completion. If you don’t have any progress, then you can choose the Full Quest and get a discount) All unique Garden of Salvation Raid Gear exclusive only to this raid Some Spoils of Conquest All other Legendary and Exotic loot that drops during the service Experience for your Season Pass and Artifact",0.89,,https://skycoach.gg/storage/uploads/products/divinity1621634597_picture_item.png,Destiny 2,Destiny 2
180,,Sacred Provenance,"Buy Sacred Provenance legendary Destiny 2 Pulse Rifle now. It’s a four-round burst, high-impact frame pulse rifle, known for its precision and long-range capability. With this weapon service, you will get: The selected number of Random Rolls or Deepsight Rolls The Selected number of Sacred Provenance obtained on your character All other Legendary and Exotic loot that drops during the service Exp for your Season Pass and Artifact",13.49,,https://skycoach.gg/storage/uploads/products/sacred-provenance1621890180_picture_item.png,Destiny 2,Destiny 2
