Name,Description,Icon,Price,Category,Link
Rupture Canon,"Buy
Remnant II Rupture Canon Farm
and unlock it without the grind! This versatile weapon offers a brisk fire rate and medium-range effectiveness, capable of dealing heavy damage and providing a stagger bonus.
Here’s what you’ll get:
Rupture Canon Hand Gun farmed for you;
Everything gathered during the service;
Fast and safe delivery.
At Skycoach, our expert team will farm the Rupture Canon Hand Gun for you, unlocking new ways to dominate and assist in even the toughest battles!",https://skycoach.gg/storage/uploads/products/rupture-canon1727770285_picture_bg.png,"13,99 €",Weapons & Items,https://skycoach.gg/remnant-2-boost/weapons
Royal Hunting Bow,"Buy
Royal Hunting Bow Farm
and unlock it without the grind! This versatile weapon proves effective at medium range. It offers a lethal and silent approach to eliminate enemies with precision, making it an ideal choice for engagements that require calculated and precise shots.
Get  Royal Hunting Bow and receive:
Royal Hunting Bow farmed for you;
Everything gathered during the service;
Fast and safe delivery.
At Skycoach, our expert team will farm the Royal Hunting Bow for you, unlocking new ways to dominate and assist in even the toughest battles!",https://skycoach.gg/storage/uploads/products/royal-hunting-bow1727793014_picture_bg.png,"13,99 €",Weapons & Items,https://skycoach.gg/remnant-2-boost/weapons
Sparkfire Shotgun,"Buy
Sparkfire Shotgun Long Gun Farm
and unlock it without the grind! This versatile weapon is designed with the common Dran in mind. This weapon fires incendiary shells that apply BURNING.
Get  Sparkfire Shotgun Long Gun and receive:
Sparkfire Shotgun Long Gun farmed for you;
Everything gathered during the service;
Fast and safe delivery.
At Skycoach, our expert team will farm the Sparkfire Shotgun Long Gun for you, unlocking new ways to dominate and assist in even the toughest battles!",https://skycoach.gg/storage/uploads/products/sparkfire-shotgun1727772110_picture_bg.png,"13,99 €",Weapons & Items,https://skycoach.gg/remnant-2-boost/weapons
Sagittarius,"Buy
Sagittarius Long Gun Farm
and unlock it without the grind! This legendary high-powered bow deals excellent damage, particularly to weak spots. It shines in precise engagements at medium range, allowing skilled archers to unleash their formidable damage potential.
Get  Sagittarius Long Gun and receive:
Sagittarius Long Gun farmed for you;
Everything gathered during the service;
Fast and safe delivery.
At Skycoach, our expert team will farm the Sagittarius Long Gun for you, unlocking new ways to dominate and assist in even the toughest battles!",https://skycoach.gg/storage/uploads/products/sagittarius1727777065_picture_bg.png,"8,99 €",Weapons & Items,https://skycoach.gg/remnant-2-boost/weapons
Twisted Arbalest,"Buy
Twisted Arbalest Gun Farm
and unlock it without the grind! This weapon deals medium damage with bouncing energy discs. It is most effective in close to medium-range encounters, where its volatile nature can wreak havoc on enemies.
Get  Twisted Arbalest Long Gun and receive:
Twisted Arbalest Long Gun farmed for you;
Everything gathered during the service;
Fast and safe delivery.
At Skycoach, our expert team will farm the Twisted Arbalest Long Gun for you, unlocking new ways to dominate and assist in even the toughest battles!",https://skycoach.gg/storage/uploads/products/twisted-arbalest1727777360_picture_bg.png,"8,99 €",Weapons & Items,https://skycoach.gg/remnant-2-boost/weapons
Corrupted Aphelion,"Buy
Corrupted Aphelion Gun Farm
and unlock it without the grind! This weapon is the corrupted version of the Aphelion, which comes automatically equipped with Micronova Weapon Mod.
Get  Corrupted Aphelion Long Gun and receive:
Corrupted Aphelion Long Gun farmed for you;
Everything gathered during the service;
Fast and safe delivery.
At Skycoach, our expert team will farm the Corrupted Aphelion Long Gun for you, unlocking new ways to dominate and assist in even the toughest battles!",https://skycoach.gg/storage/uploads/products/corrupted-aphelion1727793053_picture_bg.png,"35,99 €",Weapons & Items,https://skycoach.gg/remnant-2-boost/weapons
Corrupted Deceit,"Buy
Corrupted Deceit Gun Farm
and unlock it without the grind! This weapon is the corrupted counterpart of the Deceit, which comes automatically equipped with Windfall Weapon Mod.
Get  Corrupted Deceit Long Gun and receive:
Corrupted Deceit Long Gun farmed for you;
Everything gathered during the service;
Fast and safe delivery.
At Skycoach, our expert team will farm the Corrupted Deceit Long Gun for you, unlocking new ways to dominate and assist in even the toughest battles!",https://skycoach.gg/storage/uploads/products/corrupted-deceit1727778635_picture_bg.png,"35,99 €",Weapons & Items,https://skycoach.gg/remnant-2-boost/weapons
Corrupted Merciless,"Buy
Corrupted Merciless Gun Farm
and unlock it without the grind! This weapon is the corrupted counterpart of the Merciless, which comes automatically equipped with Bloodshot Weapon Mod.
Get  Corrupted Merciless Long Gun and receive:
Corrupted Merciless Long Gun farmed for you;
Everything gathered during the service;
Fast and safe delivery.
At Skycoach, our expert team will farm the Corrupted Merciless Long Gun for you, unlocking new ways to dominate and assist in even the toughest battles!",https://skycoach.gg/storage/uploads/products/corrupted-merciless1727778860_picture_bg.png,"35,99 €",Weapons & Items,https://skycoach.gg/remnant-2-boost/weapons
Polygun,"Buy
Polygun Farm
and unlock it without the grind!  It is a powerful weapon that can be obtained after completing the challenge of destroying 13 hidden cubes in the Labyrinth without dying.
Get Polygun Long Gun and receive:
Polygun Long Gun farmed for you;
Everything gathered during the service;
Fast and safe delivery.
At Skycoach, our expert team will farm the Polygun Long Gun for you, unlocking new ways to dominate and assist in even the toughest battles!",https://skycoach.gg/storage/uploads/products/polygun1727779141_picture_bg.png,"22,49 €",Weapons & Items,https://skycoach.gg/remnant-2-boost/weapons
Disciple Armor,"Buy Remnant 2 Disciple Armor on Skycoach and get the Forgotten Kingdom DLC's full armor set.
While the Disciple Armor itself isn't hidden deep within the game, acquiring it can be tedious. You need to progress through the DLC to a specific boss, then backtrack and navigate a treacherous tunnel filled with deadly traps and arrows that require precise timing to avoid.
Here's what you'll get if you buy our cheap Remnant Disciple Armor:
Full
Disciple Armor
set obtained;
All the
gear
and
resources
that will drop during the service.
Skip the grind and be the first to dominate The Forgotten Kingdom!",https://skycoach.gg/storage/uploads/products/disciple-armor1713960307_picture_bg.webp,"13,49 €",Weapons & Items,https://skycoach.gg/remnant-2-boost/weapons
Thorn,"Buy
Thorn Farm
and unlock it without the grind!  It is a brand-new Long Gun that debuts in The Forgotten Kingdom DLC and comes automatically equipped with Deadwood Weapon Mod.
Get Thorn Long Gun and receive:
Thorn Long Gun farmed for you;
Everything gathered during the service;
Fast and safe delivery.
At Skycoach, our expert team will farm the Thorn Long Gun for you, unlocking new ways to dominate and assist in even the toughest battles!",https://skycoach.gg/storage/uploads/products/thorn1727779546_picture_bg.png,"22,49 €",Weapons & Items,https://skycoach.gg/remnant-2-boost/weapons
Battle Armor,"Buy Remnant 2 Battle Armor to skip all Proven Grounds tedious puzzles.
Here's what you'll get:
Full
Battle Armor
set obtained;
All the
gear
and
resources
that will drop during the service.
Obtaining this set definitely presents a challenge. To get Remnant Disciple Armor, you need to progress far enough in the DLC to reach Yaesha, a later zone. Once there, finding the specific Proving Grounds dungeon adds another layer of difficulty. The real test lies within these Proving Grounds. The obstacle course demands precise timing and platforming skills. A misstep with the moving spike traps or water geysers means restarting the entire course. To add to the complexity, puzzles involving water drainage are thrown into the mix, requiring quick thinking alongside your agility.",https://skycoach.gg/storage/uploads/products/battle-armor1713962206_picture_bg.webp,"13,49 €",Weapons & Items,https://skycoach.gg/remnant-2-boost/weapons
Campaign Completion (Apocalypse),"Campaign completed on
Apocalypse
difficulty;
All the loot gathered during a boost.
The toughest challenge in Remnant II is the
Apocalypse
difficulty, which can only be unlocked after completing the game on any other difficulty level. The foes and bosses are extremely powerful, leaving no margin for mistakes. However, players who dare to take on this challenge will be rewarded with more valuable loot.
This mode is
not for the faint of heart
as it demands a deep understanding of the game mechanics and the perfect build strategy. Trust our PROs to do it for you and save you valuable time!",https://skycoach.gg/storage/uploads/products/campaign-completion-apocalypse1690181950_picture_bg.png,"21,59 €",Campaign,https://skycoach.gg/remnant-2-boost/campaign
Campaign Completion (Hardcore),"Buy Remnant 2 Hardcore Campaign boost to stop struggling with that challenging task on your own and trust your success to the game professionals, instead, for a low price.
You will get:
Hardcore
Campaign Mode completed at desired difficulty;
All the loot gathered during a boost.
For gamers seeking the ultimate challenge in a multi-world adventure,
Hardcore Mode
is the way to go. This mode leaves no room for error, making it the most unforgiving option available. If you're considering taking on this challenge, it's important to be fully prepared.
This mode is
not for the faint of heart
as it demands a deep understanding of the game mechanics and the perfect build strategy. Get our Remnant 2 Hardcore Campaign carry so we can do all the hard work for you and save you valuable time!",https://skycoach.gg/storage/uploads/products/campaign-completion-hardcore1693497609_picture_bg.webp,"14,39 €",Campaign,https://skycoach.gg/remnant-2-boost/campaign
The Dark Horizon Campaign,"Buy
The Dark Horizon Campaign Boost
and get:
Full completion of The Dark Horizon campaign, including all main missions and story progression;
Unlock key campaign rewards and exclusive items tied to the story;
Progress through N’Erud's newly expanded and vertical areas, engaging with unique environments;
Experience every plot point of the campaign, including interactions with new characters and lore discoveries;
Flexible options for any difficulty level, including selfplay.
The Dark Horizon campaign is tough due to complex maps, unpredictable enemy spawns, and challenging boss fights. N’Erud’s verticality adds extra difficulty, making combat and navigation more frustrating for solo players.
With Skycoach, you get a reliable, fast Remnant II TDH Campaign boosting service that handles all the hard parts for you. We offer selfplay, flexible difficulty options, and prioritize your account’s safety, all while delivering a seamless boosting experience.",https://skycoach.gg/storage/uploads/products/the-dark-horizon-campaign1727191541_picture_bg.webp,"13,09 €",Campaign,https://skycoach.gg/remnant-2-boost/campaign
The Awakened King Campaign,"The Awakened King Campaign completed on selected difficulty;
All the gear and loot obtained during a boost.
Remnant II
offers multiple difficulty options for the
The Awakened King Campaign
. Players can choose from several levels of difficulty, ranging from Survivor (easiest) to Apocalypse (hardest), allowing them to tailor their gameplay experience to their skill level and desired level of challenge.
By opting for higher difficulty in the
Campaign
mode of
Remnant II
, players can face tougher challenges and earn more valuable loot as a reward. However, these challenges can be very difficult and time-consuming. Trust our PROs to do it for you and save you valuable time!",https://skycoach.gg/storage/uploads/products/the-awakened-king-campaign1699953236_picture_bg.png,"13,09 €",Campaign,https://skycoach.gg/remnant-2-boost/campaign
The Forgotten Kingdom Campaign,"The Forgotten Kingdom
Campaign completed on selected difficulty;
All the gear and loot obtained during a boost.
The Forgotten Kingdom
is the second DLC for Remnant II that takes you deeper into the world of Yaesha. You'll explore a mysterious new area, uncover the secrets of a lost tribe, and face a vengeful ancient stone spirit named Lydusa and her monstrous creations.
The campaign
offers various difficulty settings, including Survivor, Veteran, Nightmare, and
Apocalypse
. Greater difficulties crank up the enemy's health, damage, and aggression, making fights much more punishing. Survival mode adds permadeath to the mix, so one wrong move can spell disaster for your character. Buy The Forgotten Kingdom boost from us and let our PROs do the tedious part for you.",https://skycoach.gg/storage/uploads/products/the-forgotten-kingdom-campaign1713180549_picture_bg.webp,"13,09 €",Campaign,https://skycoach.gg/remnant-2-boost/campaign
Adventure Mode Runs,"Up to 10 runs;
All the loot gathered during a boost.
Adventure Mode
in Remnant 2 allows players to explore dungeons, locations, and bosses they may have overlooked on their planets. Once the
Adventure Mode
is activated, a new save file will be created, preserving your campaign progress while transporting you to a previously explored or new area on your first world.
Playing
Adventure Mode
at difficult levels can be quite challenging but it enables you to get better loot. Trust our PROs to do it for you and save you time!",https://skycoach.gg/storage/uploads/products/adventure-mode-runs1690181855_picture_bg.png,"3,89 €",Campaign,https://skycoach.gg/remnant-2-boost/campaign
Campaign Completion (Choose Any Difficulty),"Campaign 100% completed on desired difficulty;
All the loot gathered during a boost.
Remnant II
offers players multiple difficulty options for the
Campaign
. Players can choose from several levels of difficulty, ranging from easy to nightmare, allowing them to tailor their gameplay experience to their skill level and desired level of challenge.
By opting for higher difficulty in the
Campaign
mode of
Remnant II
, players can face tougher challenges and earn more valuable loot as a reward. However, these challenges can be very difficult and time-consuming. Trust our PROs to do it for you and save you valuable time!",https://skycoach.gg/storage/uploads/products/campaign-completion-choose-any-difficulty1690181899_picture_bg.png,"8,09 €",Campaign,https://skycoach.gg/remnant-2-boost/campaign
Campaign Completion (Selfplay),"Playing alongside with 1 or 2
PROs
in Co-Op Campaign;
Desired amount of hours;
All the loot gathered during a boost.
If you're struggling with the Campaign in
Remnant II
, don't worry, our service has got your back!
We offer the option to play with one or two
professional players
who can guide you through the game and make your life easier. This can save you time and frustration, while still allowing you to experience all the excitement and challenge of the game. So why not
give it a try
and see how much easier the game can be with some expert help?",https://skycoach.gg/storage/uploads/products/campaign-completion-selfplay1690181964_picture_bg.png,"7,19 €",Campaign,https://skycoach.gg/remnant-2-boost/campaign
Annihilation Boss Kill,"Annihilation
Final Boss killed at any difficulty;
All the loot gathered during a boost.
The ultimate adversary in the game is
Annihilation
, the Remnant 2 Final Boss. It presents a grueling and extensive obstacle for players. This enemy is the most difficult opponent you will encounter throughout the entire game, and it will thoroughly examine your abilities with its destructive assaults and perplexing mechanics. Trust our PROs to defeat this formidable boss for you and save you time!",https://skycoach.gg/storage/uploads/products/annihilation-boss-kill1690458285_picture_bg.webp,"3,14 €",Bosses,https://skycoach.gg/remnant-2-boost/bosses
Remnant 2 Bosses Kill,"Desired Boss
killed at any difficulty;
All the loot gathered during a boost.
In Remnant 2, players will come across powerful
Bosses
that pose a unique challenge. These formidable foes boast higher health and damage than regular Enemies and showcase distinct moves and abilities. Additionally, they may possess a special trait that enhances their strength or introduces new mechanics to the fight.
Trust our
PROs
to defeat any boss for you and save you time!",https://skycoach.gg/storage/uploads/products/remnant-2-bosses-kill1692201689_picture_bg.webp,"0,89 €",Bosses,https://skycoach.gg/remnant-2-boost/bosses
Lydusa Boss Kill,"Buy Remnant II Lydusa boost to overcome The Forgotten Kingdom's challenging encounter!
The formidable Lydusa in Remnant II: The Forgotten Kingdom is the ultimate challenge of the DLC. This colossal, ancient stone spirit isn't just another enemy to mow down. She boasts a massive health pool, making the fight a war of attrition, and also unleashes a devastating array of attacks. The later stages incorporate platforming elements, requiring you to navigate a perilous environment while dodging attacks.
Here's what you'll get by buying Remnant 2 Lydusa Kill on Skycoach:
Lydusa
boss killed at any difficulty;
All the loot obtained during a boost.",https://skycoach.gg/storage/uploads/products/lydusa-boss-kill1713974087_picture_bg.webp,"5,99 €",Bosses,https://skycoach.gg/remnant-2-boost/bosses
The One True King Boss Kill,"The One True King
boss killed at any difficulty;
All the loot obtained during a boost.
Trust our PROs to defeat this boss for you and save you time!",https://skycoach.gg/storage/uploads/products/the-one-true-king-boss-kill1700052205_picture_bg.png,"5,99 €",Bosses,https://skycoach.gg/remnant-2-boost/bosses
The Sunken Witch Boss Kill,"The
Sunken Witch
boss killed at any difficulty;
All the loot obtained during a boost.
Sunken Witch
is a boss in Losomn, one of the several The Awakened King DLC bosses.
Trust our PROs to defeat this boss for you and save you time!",https://skycoach.gg/storage/uploads/products/the-sunken-witch-boss-kill1699954431_picture_bg.png,"5,99 €",Bosses,https://skycoach.gg/remnant-2-boost/bosses
"Bruin, Blade of the King Boss Kill","Bruin, the Blade of the King
boss killed at any difficulty;
All the loot obtained during a boost.
Bruin
is a boss in Losomn, one of the several The Awakened King DLC bosses.
Trust our PROs to defeat this boss for you and save you time!",https://skycoach.gg/storage/uploads/products/bruin-blade-of-the-king-boss-kill1698951673_picture_bg.png,"5,99 €",Bosses,https://skycoach.gg/remnant-2-boost/bosses
The Nightweaver Boss Kill,"The Nightweaver
boss killed at any difficulty;
All the loot gathered during a boost.
The Nightweaver
is a world boss in Losomn, one of two possible mandatory Remnant 2 bosses there. She was once a Fae goddess of sleep, but now terrifies the Dran with her dreamlike powers.
The Nightweaver
feeds on the life force of her victims, leaving them drained and close to death.
Trust our PROs to defeat this boss for you and save you time!",https://skycoach.gg/storage/uploads/products/the-nightweaver-boss-kill1690293994_picture_bg.webp,"3,14 €",Bosses,https://skycoach.gg/remnant-2-boost/bosses
Sha'Hala Boss Kill,"Sha'Hala
boss killed at any difficulty;
All the loot gathered during a boost.
Sha'Hala: Spectral Guardian of N'Erud
is a world boss in N'Erud, one of two possible mandatory Remnant 2 bosses there. Trust our PROs to defeat this tough boss for you and save you time!",https://skycoach.gg/storage/uploads/products/shahala-boss-kill1690295465_picture_bg.webp,"4,04 €",Bosses,https://skycoach.gg/remnant-2-boost/bosses
Tal'Ratha (Metaphysical) Boss Kill,"Tal'Ratha (Metaphysical)
boss killed at any difficulty;
All the loot gathered during a boost.
Tal'Ratha (Metaphysical)
is a Remnant 2 Boss that players can face after being devoured by him. This giant creature presents a  challenge to those who dare to confront him. Trust our PROs to defeat this boss for you and save you time!",https://skycoach.gg/storage/uploads/products/talratha-metaphysical-boss-kill1690295923_picture_bg.webp,"4,04 €",Bosses,https://skycoach.gg/remnant-2-boost/bosses
Faelin Boss Kill,"Faelin
boss killed at any difficulty;
All the loot gathered during a boost.
Faelin
is a Remnant 2 world boss in Losomn, one of two possible mandatory Remnant 2 bosses there.
Faelin
is the counterpart of Faerin, he becomes available with the choice of the player. Trust our PROs to defeat this boss for you and save you time!",https://skycoach.gg/storage/uploads/products/faelin-boss-kill1690297223_picture_bg.webp,"3,14 €",Bosses,https://skycoach.gg/remnant-2-boost/bosses
Faerin Boss Kill,"Faerin
boss killed at any difficulty;
All the loot gathered during a boost.
Faerin
is a Remnant 2 world boss in Losomn, one of two possible mandatory Remnant 2 bosses there.
Faerin
is the counterpart of Faelin, he becomes available with the choice of the player. Trust our PROs to defeat this boss for you and save you time!",https://skycoach.gg/storage/uploads/products/faerin-boss-kill1690297345_picture_bg.webp,"3,14 €",Bosses,https://skycoach.gg/remnant-2-boost/bosses
Tal'Ratha Boss Kill,"Tal'Ratha
boss killed at any difficulty;
All the loot gathered during a boost.
Tal'Ratha
is a Remnant 2 Boss, one of the 2 world bosses that can possibly be encountered in N'Erud. Players can face
Tal'Rathta
if they choose not to be devoured by him in initial dialogue. Trust our PROs to defeat this boss for you and save you time!",https://skycoach.gg/storage/uploads/products/talratha-boss-kill1690456042_picture_bg.webp,"4,04 €",Bosses,https://skycoach.gg/remnant-2-boost/bosses
Corruptor Boss Kill,"Corruptor
boss killed at any difficulty;
All the loot gathered during a boost.
In Remnant 2, Yaesha's world boss is known as the
Corruptor
. This massive Root creature has taken control of the Thaen and employs the Pan's former guardian as its personal protector. Engaging in battle with the
Corruptor
presents a formidable challenge. Trust our PROs to defeat this boss for you and save you time!",https://skycoach.gg/storage/uploads/products/corruptor-boss-kill1690456550_picture_bg.webp,"3,14 €",Bosses,https://skycoach.gg/remnant-2-boost/bosses
The Ravager Boss Kill,"The Ravager
boss killed at any difficulty;
All the loot gathered during a boost.
In the world of Yaesha, players will encounter the formidable
Ravager
, a world Boss that serves as a major storyline challenge. Once a revered deity of the Pan,
the
Ravager
was left for dead by the Wanderer and subsequently corrupted by the Root. This massive creature has taken control of the Thaen and employs the former guardian of the Pan as its personal protector. Defeating
the Ravager
is no easy feat and requires great skill and strategy. Trust our PROs to defeat this boss for you and save you time!",https://skycoach.gg/storage/uploads/products/the-ravager-boss-kill1690456895_picture_bg.webp,"3,14 €",Bosses,https://skycoach.gg/remnant-2-boost/bosses
Labyrinth Sentinel Boss Kill,"Labyrinth Sentinel
boss killed at any difficulty;
All the loot gathered during a boost.
One of the bosses that players will face is the
Labyrinth Sentinel
made of stone. Although this boss may seem easy at first glance, the large stone blocks can quickly crush players to death if they don't know how to deal with the creature. Trust our PROs to defeat this boss for you and save you time!",https://skycoach.gg/storage/uploads/products/labyrinth-sentinel-boss-kill1690457442_picture_bg.webp,"3,14 €",Bosses,https://skycoach.gg/remnant-2-boost/bosses
Warden Unlock,"Buy
Remnant 2 Warden Unlock
and get:
Full Warden Archetype unlock;
Access to unique perks like Dynamic;
Versatile drone abilities (Heal, Shield, and Combat);
Exclusive trait upgrades for shield efficiency.
Unlock the Warden Archetype in Remnant II and gain access to one of the most versatile support classes in the game. The Warden brings powerful drone abilities to the battlefield, offering healing, shielding, and combat support. Whether you're defending allies with the Shield Drone or boosting your team's damage with the Combat Drone, the Warden adapts to any playstyle. By unlocking this Archetype, you'll also benefit from perks like Dynamic, which enhances shield regeneration and increases your drone's energy reserves. Perfect for those who want to master battlefield control and provide crucial support to their team.
At Skycoach, our Remnan 2 Warden unlock service is fast, reliable, and 100% safe. Unlock the Warden and start leading your team with superior support today.",https://skycoach.gg/storage/uploads/products/warden-unlock1726758327_picture_bg.webp,"11,99 €",Archetypes & Leveling,https://skycoach.gg/remnant-2-boost/classes-leveling
