Name,Description,Icon,Price,Category,Link
Full Map 100% | All Regions & Main Quests,"Complete every zone, uncover every secret, and finish the full storyline across all regions in Wuthering Waves. This is the perfect option for players who want full exploration, all main quests completed, and nothing left behind—without spending days grinding.
What You’ll Get
Full 100% Map Completion
All exploration objectives finished across all regions
All Main Quests Completed
Achievement Progression
Union, Data Bank, Character & Weapon Levels
Tons of Rewards
Safe, Hand-Played Boosting
Optional Add-Ons
Complete All Companion Stories – Unlock and finish every available character story to dive deeper into the lore and build stronger bonds with your resonators.
Complete All Side Quests – Get every side quest done across all regions for extra rewards, lore content, and progression boosts.",https://skycoach.gg/storage/uploads/products/full-map-100-all-regions-main-quests1749643200_picture_bg.png,"98,99 €",Exploration,https://skycoach.gg/wuthering-waves-boost/exploration
Rinascita 100% Exploration,"Buy WuWa Rinascita Exploration Boost and enjoy a fully explored map—every chest, puzzle, and secret uncovered.
What You’ll Get
Selected Rinascita areas 100% explored.
All required items collected.
All required puzzles solved.
All required side-quests completed.
List of Included Areas
2.0 Areas:
Ragunna City, Penitent's End, Whisperwind Haven, Fagaceae Peninsula, Averardo Vault, Hallowed Reach, Nimbus Sanctum, Thessaleo Fells.
2.1 Areas:
Riccioli Islands, Vault Underground.
2.2 Areas:
Avinoleum, Beohr Waters.
2.4 Areas:
Septimont.
Why spend hours combing the map when the rewards could already be yours? WuWa Rinascita 100% Exploration service ensures precision and speed, leaving no corner unsearched. Entrust your journey to us.",https://skycoach.gg/storage/uploads/products/rinascita-100-exploration1736426209_picture_bg.png,"4,49 €",Exploration,https://skycoach.gg/wuthering-waves-boost/exploration
Huanglong 100% Exploration,"Buy WuWa Huanglong Exploration boost and unlock every chest, secret, and achievement to get a complete exploration experience and all the unique rewards, without hours of grinding or missing anything.
What You’ll Get
Selected Huanglong areas 100% explored.
All required items collected.
All required puzzles solved.
All required side-quests completed.
List of Included Areas
1.0 Areas:
Central Plains, Desorock Highland, Dim Forest, Gorges of Spirits, Jinzhou, Mt. Firmament, Norfall Barrens, Port City of Guixu, Tiger's Maw, Whining Aix's Mire, Wuming Bay.",https://skycoach.gg/storage/uploads/products/huanglong-100-exploration1749641012_picture_bg.png,"4,49 €",Exploration,https://skycoach.gg/wuthering-waves-boost/exploration
The Black Shores 100% Exploration,"Buy WuWa The Black Shores Exploration boost and unlock every chest, secret, and achievement to get a complete exploration experience and all the unique rewards, without hours of grinding or missing anything.
What You’ll Get
Selected The Black Shores areas 100% explored.
All required items collected.
All required puzzles solved.
All required side-quests completed.
List of Available Areas
Black Shores Archipelago
Tethys' Deep.",https://skycoach.gg/storage/uploads/products/the-black-shores-100-exploration1749641978_picture_bg.png,"4,99 €",Exploration,https://skycoach.gg/wuthering-waves-boost/exploration
WuWa Main Quests,"Buy Wuthering Waves Main Quests Boost to complete any act or the full story quickly and safely. Our team will handle the progression so you can enjoy the rewards without delays.
This Wuthering Waves Main Quests boosting service saves time, unlocks content faster, and strengthens your account. All boosts are completed securely by experienced players.
What You’ll Get
Completion of selected main quest act(s) or the full story.
All rewards and items obtained during the service.
Character progression and additional materials collected.
Significant time savings compared to solo play.
The Wuthering Waves Main Story Boost is completed professionally with a strong focus on account security and efficiency.",https://skycoach.gg/storage/uploads/products/wuwa-main-quests-boost1745948936_picture_bg.png,"4,99 €",Exploration,https://skycoach.gg/wuthering-waves-boost/exploration
Jinzhou 100% Exploration,"Buy
Jinzhou 100% Boost
and unlock all secrets, treasures, and challenges in the region to dominate Wuthering Waves like never before!
The Jinzhou Region is a crucial and expansive area in Wuthering Waves. Fully exploring this region can be daunting, as it features vast and complex terrain, hidden collectibles, powerful enemies, and intricate quests. However, the WuWa Jinzhou Exploration Boost provides players with the necessary advantages and shortcuts to overcome these challenges and dominate the region.
Here's what you'll get:
Jinzhou Region 100% Explored;
All region's collectibles (Blobflies, Sonance Caskets, Supply Chests, etc.) gathered;
All puzzles solved;
All quests need to be done.
We got your back. You can buy Wuthering Waves Jinzhou Boost at Skycoach, your trusted source for in-game enhancements and boosts. Elevate your gaming experience and conquer Jinzhou with ease!",https://skycoach.gg/storage/uploads/products/jinzhou-100-exploration1717341392_picture_bg.png,"4,49 €",Exploration,https://skycoach.gg/wuthering-waves-boost/exploration
Central Plains 100% Exploration,"Buy
Central Plains 100% Boost
and unlock all the secrets, treasures, and challenges in this historic region of Wuthering Waves!
The Central Plains Region is a significant area in Wuthering Waves. Exploring this region can be challenging due to its large and complex landscape, hidden items to collect, tough opponents, and elaborate missions. However, the WuWa Central Plains Exploration Boost provides players with essential benefits and quick routes to overcome these challenges and conquer the region.
Here's what you'll get:
Central Plains Region 100% Explored;
All region's collectibles (Blobflies, Sonance Caskets, Supply Chests, etc.) gathered;
All puzzles solved;
All quests need to be done.
At Skycoach, you can buy Wuthering Waves Central Plains Boost cheap and easily. Elevate your gaming experience and conquer Huanglong now!",https://skycoach.gg/storage/uploads/products/central-plains-100-exploration1717341391_picture_bg.png,"4,49 €",Exploration,https://skycoach.gg/wuthering-waves-boost/exploration
Dim Forest 100% Exploration,"Buy
Dim Forest 100% Boost
and get access to hidden areas, exclusive rewards, and faster progression in Wuthering Waves!
The Dim Forest is a dense and mysterious region in Wuthering Waves. Fully exploring this region can be challenging, as it features vast and intricate terrain, hidden collectibles, powerful enemies, and intricate quests. However, the WuWa Dim Forest Exploration Boost provides players with the necessary advantages and shortcuts to overcome these challenges and dominate the region.
Here's what you'll get:
Dim Forest Region 100% Explored;
All region's collectibles (Blobflies, Sonance Caskets, Supply Chests, etc.) gathered;
All puzzles solved;
All quests need to be done.
Buy Wuthering Waves Dim Forest boost cheap and start your journey today!",https://skycoach.gg/storage/uploads/products/dim-forest-100-exploration1717341397_picture_bg.png,"4,49 €",Exploration,https://skycoach.gg/wuthering-waves-boost/exploration
Gorges of Spirits 100% Exploration,"Buy
Gorges of Spirits 100% Boost
and unlock all the secrets, treasures, and challenges in this spiritual region of Wuthering Waves!
The Gorges of Spirits is a revered and breathtaking area within Wuthering Waves. Its extensive and complex landscape, along with hidden collectibles, formidable foes, and detailed quests, make it a challenging area to explore fully. The WuWa Gorges of Spirits Exploration Boost offers players the essential advantages and shortcuts needed to conquer these challenges and master the region.
Here's what you'll get:
Gorges of Spirits Region 100% Explored;
All region's collectibles (Blobflies, Sonance Caskets, Supply Chests, etc.) gathered;
All puzzles solved;
All quests need to be done.
Buy Wuthering Waves Gorges of Spirits boost cheap and enhance your adventure today!",https://skycoach.gg/storage/uploads/products/gorges-of-spirits-100-exploration1717341407_picture_bg.png,"4,49 €",Exploration,https://skycoach.gg/wuthering-waves-boost/exploration
Desorock Highland 100% Exploration,"Buy
Desorock Highland 100% Boost
and gain an edge in Wuthering Waves with rapid progression, exclusive rewards, and undiscovered areas!
Desorock Highland is a sprawling and rugged terrain in Wuthering Waves. Its expansive and intricate landscape, hidden collectibles, tough enemies, and complex quests present a significant challenge to explorers. The WuWa Desorock Highland Exploration Boost provides players with vital advantages and shortcuts to overcome these hurdles and dominate the highland.
Here's what you'll get:
Desorock Highland Region 100% Explored;
All region's collectibles (Blobflies, Sonance Caskets, Supply Chests, etc.) gathered;
All puzzles solved;
All quests need to be done.
Buy Wuthering Waves Desorock Highland boost cheap and embark on your journey now!",https://skycoach.gg/storage/uploads/products/desorock-highland-100-exploration1717341415_picture_bg.png,"4,49 €",Exploration,https://skycoach.gg/wuthering-waves-boost/exploration
Port City of Guixu 100% Exploration,"Buy
Port City of Guixu 100% Boost
and reveal all the secrets, treasures, and challenges in this bustling metropolis of Wuthering Waves!
The Port City of Guixu is a lively and intricate region in Wuthering Waves. Fully exploring this urban area can be overwhelming due to its vast and complex layout, hidden collectibles, powerful enemies, and numerous quests. The WuWa Port City of Guixu Exploration Boost equips players with the necessary advantages and shortcuts to navigate and conquer this vibrant city.
Here's what you'll get:
Port City of Guixu Region 100% Explored;
All region's collectibles (Blobflies, Sonance Caskets, Supply Chests, etc.) gathered;
All puzzles solved;
All quests need to be done.
Buy Wuthering Waves Port City of Guixu boost cheap and enhance your gaming experience!",https://skycoach.gg/storage/uploads/products/port-city-of-guixu-100-exploration1717341425_picture_bg.png,"4,49 €",Exploration,https://skycoach.gg/wuthering-waves-boost/exploration
Wuming Bay 100% Exploration,"Buy
Wuming Bay 100% Boost,
unlock hidden areas and exclusive rewards, and achieve faster progression in Wuthering Waves!
Wuming Bay is a picturesque and serene region in Wuthering Waves. Fully exploring this expansive area is challenging due to its intricate terrain, concealed collectibles, powerful adversaries, and detailed quests. The WuWa Wuming Bay Exploration Boost provides players with the essential advantages and shortcuts needed to excel in this region.
Here's what you'll get:
Wuming Bay Region 100% Explored;
All region's collectibles (Blobflies, Sonance Caskets, Supply Chests, etc.) gathered;
All puzzles solved;
All quests need to be done.
Buy Wuthering Waves Wuming Bay boost cheap and start your journey today!",https://skycoach.gg/storage/uploads/products/wuming-bay-100-exploration1717341435_picture_bg.png,"4,49 €",Exploration,https://skycoach.gg/wuthering-waves-boost/exploration
Norfall Barrens 100% Exploration,"Buy
Norfall Barrens 100% Boost
and discover all the secrets, treasures, and challenges in this harsh and unforgiving region of Wuthering Waves!
The Norfall Barrens is a tough and relentless area in Wuthering Waves. Its extensive and complex terrain, hidden collectibles, strong enemies, and intricate quests make it a formidable challenge to explore completely. The WuWa Norfall Barrens Exploration Boost offers players the crucial advantages and shortcuts to conquer these difficulties and master the barrens.
Here's what you'll get:
Norfall Barrens Region 100% Explored;
All region's collectibles (Blobflies, Sonance Caskets, Supply Chests, etc.) gathered;
All puzzles solved;
All quests need to be done.
Buy Wuthering Waves Norfall Barrens boost cheap and elevate your adventure now!",https://skycoach.gg/storage/uploads/products/norfall-barrens-100-exploration1717341445_picture_bg.png,"4,49 €",Exploration,https://skycoach.gg/wuthering-waves-boost/exploration
Tiger's Maw 100% Exploration,"Buy
Tiger's Maw 100% Boost
and gain the upper hand in Wuthering Waves with swift progression, exclusive rewards, and hidden areas!
Tiger's Maw is a dangerous and challenging region in Wuthering Waves. Its expansive and complex landscape, hidden collectibles, powerful adversaries, and detailed quests make full exploration a daunting task. The WuWa Tiger's Maw Exploration Boost provides players with the necessary advantages and shortcuts to overcome these challenges and dominate this wild region.
Here's what you'll get:
Tiger's Maw Region 100% Explored;
All region's collectibles (Blobflies, Sonance Caskets, Supply Chests, etc.) gathered;
All puzzles solved;
All quests need to be done.
Buy Wuthering Waves Tiger's Maw boost cheap and begin your conquest today!",https://skycoach.gg/storage/uploads/products/tigers-maw-100-exploration1717341458_picture_bg.png,"4,49 €",Exploration,https://skycoach.gg/wuthering-waves-boost/exploration
Whining Aix's Mire 100% Exploration,"Buy
Whining Aix's Mire 100% Boost
and reveal all the secrets, treasures, and challenges in this eerie and mysterious region of Wuthering Waves!
Whining Aix's Mire is a dark and ominous area in Wuthering Waves. Fully exploring this swampy region is difficult due to its vast and intricate terrain, hidden collectibles, strong enemies, and complex quests. The WuWa Whining Aix's Mire Exploration Boost offers players the essential advantages and shortcuts to navigate and master this challenging area.
Here's what you'll get:
Whining Aix's Mire Region 100% Explored;
All region's collectibles (Blobflies, Sonance Caskets, Supply Chests, etc.) gathered;
All puzzles solved;
All quests need to be done.
Take control—buy Wuthering Waves Whining Aix's Mire boost cheap and master the mire today!",https://skycoach.gg/storage/uploads/products/whining-aixs-mire-100-exploration1717341464_picture_bg.png,"4,49 €",Exploration,https://skycoach.gg/wuthering-waves-boost/exploration
Mt. Firmament 100% Exploration,"Buy
Mt. Firmament 100% Boost
and unlock the location's mysteries!
Mt. Firmament in Wuthering Waves offers vast landscapes, hidden treasures, and tough challenges. With the Mt. Firmament Exploration Boost, you gain valuable shortcuts and advantages to master this intricate region.
Here's what you'll get:
Mt. Firmament Region 100% Explored;
All region's collectibles (Blobflies, Sonance Caskets, Supply Chests, etc.) gathered;
All puzzles solved;
All quests need to be done.
Get your boost at Skycoach and elevate your gameplay. Conquer the heights of Mt. Firmament now!",https://skycoach.gg/storage/uploads/products/mt-firmament-100-exploration1719675447_picture_bg.png,"4,49 €",Exploration,https://skycoach.gg/wuthering-waves-boost/exploration
WuWa Main Quests,"Buy Wuthering Waves Main Quests Boost to complete any act or the full story quickly and safely. Our team will handle the progression so you can enjoy the rewards without delays.
This Wuthering Waves Main Quests boosting service saves time, unlocks content faster, and strengthens your account. All boosts are completed securely by experienced players.
What You’ll Get
Completion of selected main quest act(s) or the full story.
All rewards and items obtained during the service.
Character progression and additional materials collected.
Significant time savings compared to solo play.
The Wuthering Waves Main Story Boost is completed professionally with a strong focus on account security and efficiency.",https://skycoach.gg/storage/uploads/products/wuwa-main-quests-boost1745948936_picture_bg.png,"4,99 €",Leveling,https://skycoach.gg/wuthering-waves-boost/leveling
Union Level Boost,"Buy
WuWa Union Level Boost
and let us streamline your journey!
Advancing your union levels in Wuthering Waves can be complex and time-consuming, involving numerous repetitive tasks and intricate challenges. You must overcome these hurdles before accessing the higher-tier content and more formidable enemies. This can take a significant amount of your time, which could be better spent immersing yourself in the game's dynamic world and engaging storyline.
Our Wuthering Waves Union Leveling service offers efficient and secure advancement for your union. Our skilled professionals will handle the grind, ensuring your union levels up swiftly and correctly.
Here's what you'll get:
Union Level you desire;
Some extra Lustrous Tide and Astrite;
Some Data Bank EXP;
All the loot dropped during the boost.
Enjoy a seamless gaming experience with our expert assistance!",https://skycoach.gg/storage/uploads/products/union-level-boost1717350573_picture_bg.png,"6,59 €",Leveling,https://skycoach.gg/wuthering-waves-boost/leveling
Resonator Leveling,"Buy
WuWa Resonator Level Boost
and get any desired level in no time!
Leveling up your resonators in Wuthering Waves can be a daunting task, filled with repetitive and time-consuming activities. Before diving into the rich, high-level content and intense battles, you must endure the grind. This can consume much of your valuable time, which could be spent exploring the game’s intricate world and captivating storyline.
Let us take the hassle out of leveling for you! Our professional Wuthering Waves Character Leveling boost offers efficient and secure character progression.
Here's what you'll get:
90 Resonator Level;
All necessary Ascension Materials farmed;
Some Union Level and Data Bank EXP;
All the loot dropped during the boost.
Focus on enjoying the breathtaking visuals and deep narrative of Wuthering Waves while we handle the rest!",https://skycoach.gg/storage/uploads/products/resonator-leveling1717344865_picture_bg.png,"12,99 €",Leveling,https://skycoach.gg/wuthering-waves-boost/leveling
Data Bank Leveling,"Buy
WuWa Data Bank Level Boost
and get any desired level quickly!
Enhancing your Data Bank in Wuthering Waves is essential for unlocking powerful abilities and advanced content, but it can be tedious and time-consuming. The process requires repetitive tasks and strategic resource management, which can detract from the enjoyment of the game’s captivating storyline and breathtaking visuals.
Allow us to simplify your journey! Our Data Bank Leveling service in Wuthering Waves offers efficient and secure enhancement of your Data Bank. Our team of experienced players will handle the grind, ensuring your Data Bank levels up swiftly and accurately.
Here's what you'll get:
Data Bank Level you desire;
Drop Rate of Echoes and the max absorbable Rarity of Echoes increased;
Max stamina increased;
All the loot dropped during the boost.
Experience Wuthering Waves to the fullest with our professional assistance, and let us handle the heavy lifting.",https://skycoach.gg/storage/uploads/products/data-bank-leveling1717353334_picture_bg.png,"4,59 €",Leveling,https://skycoach.gg/wuthering-waves-boost/leveling
Weapon Leveling,"Buy
WuWa Weapon Level Boost
and get any desired level in no time!
Leveling up your weapons in Wuthering Waves can be a daunting task, filled with repetitive and time-consuming activities. Before diving into the rich, high-level content and intense battles, you must endure the grind. This can consume much of your valuable time, which could be spent exploring the game’s intricate world and captivating storyline.
Let us take the hassle out of weapon leveling for you! Our professional Wuthering Waves Weapon Leveling boost offers efficient and secure progression.
Here's what you'll get:
90 Weapon Level;
All necessary Ascension Materials farmed;
Some Union Level and Data Bank EXP;
All the loot dropped during the boost.",https://skycoach.gg/storage/uploads/products/weapon-leveling1718152895_picture_bg.png,"8,99 €",Leveling,https://skycoach.gg/wuthering-waves-boost/leveling
WuWa Builds,"Buy Wuthering Waves Build Service and get a fully optimized character, ready to perform at their peak in any content. We handle all the grinding—from leveling and weapon enhancement to skill upgrades and Echo setup—so you can enjoy a polished, high-performance build without the time sink.
What’s Included
1–90 Character Leveling – Fast and complete progression to max level
Fully Upgraded 4★ F2P Weapon – Best free-to-play option for your chosen resonator
Max-Level Echo Set – Fully enhanced best-in-slot Echoes with the optimal Sonata Effect, ideal cost distribution, and substats as close to perfect as possible
Optimized Skill Upgrades – All key abilities leveled up with correct priority for your character’s role",https://skycoach.gg/storage/uploads/products/wuwa-builds1749651195_picture_bg.png,"69,99 €",Farming,https://skycoach.gg/wuthering-waves-boost/farming
Echoes Farming,"Buy the Echoes boost in Wuthering Waves to get new companions and freshen up the gameplay. Customize your order to make sure your new Echoes add the most power to the team. Use the God Roll option to increase the potency of the WuWa Echoes boosting service to the maximum.
What You’ll Get
All of the selected Echoes;
Desired main stats;
The best possible Echo stats (only with the God Roll option).
Optional Add-Ons
Express Service:
Accelerate completion for quicker results.
Super Express:
The fastest option for the quickest possible completion of your service.
Echoes farming boost combines the expertise of Wuthering Waves' seasoned players with reliable account protection measures. The result is peace of mind and unparalleled service quality. We always ensure your WuWa journey is safe and seamless.",https://skycoach.gg/storage/uploads/products/echoes-farming1744291572_picture_bg.png,"0,99 €",Farming,https://skycoach.gg/wuthering-waves-boost/farming
Tower of Adversity Boost,"Buy
Wuthering Waves Tower of Adversity Boost
and conquer the toughest challenges with ease.
The Tower of Adversity in Wuthering Waves is renowned for its formidable difficulty, demanding strategic prowess and impeccable skills from even the most seasoned players. Many adventurers find themselves stuck, unable to progress due to the tower’s escalating challenges and intricate boss mechanics. Boosting services can provide the edge needed to overcome these obstacles and continue your journey.
Here’s what you’ll get:
Astrite;
Credits;
Hazard Records;
Everything that will be dropped during the service.
At Skycoach, you can buy a Wuthering Waves Rumbling Hollows boost fast and cheap, ensuring you can enjoy seamless progression through the game’s hardest content. Our professional boosting services are designed to help you achieve your goals effortlessly and efficiently.",https://skycoach.gg/storage/uploads/products/tower-of-adversity-boost1722204170_picture_bg.png,"0,99 €",Farming,https://skycoach.gg/wuthering-waves-boost/farming
Whimpering Wastes Boost,"Buy Whimpering Wastes Boost to clear specific stages (1–12) or full regions like Forbidden Waters, Chasm, or Torrents in Wuthering Waves. Whether you're stuck on one fight or aiming to complete all content, we help you reach your goals faster.
This boosting service adapts to your team strength. We optimize your setup to achieve the highest possible score and unlock as many rewards as your roster allows.
What You’ll Get
Completion of selected stages or entire regions
Up to 1600 Astrite, based on what you choose
All milestone rewards your team can reach
Progress toward Ocean is a Soul’s Rest and stage unlocks
Two-team clears with token and modifier strategy
Note:
Final scores depend on your team strength—we aim for the best possible results with what you have.
Every Whimpering Wastes carry is handled by trusted pros using secure methods. We deliver efficient, reliable results—no risk, no hassle.",https://skycoach.gg/storage/uploads/products/whimpering-wastes-boost1745511344_picture_bg.png,"3,99 €",Farming,https://skycoach.gg/wuthering-waves-boost/farming
Tactical Hologram Boost,"Buy WuWa Holograms Boost, power through Tactical Holograms in Wuthering Waves and claim the rewards you’ve been eyeing. Exclusive Echoes. Coveted Data Sets. A boost to your progression. And you? Free to enjoy the results while we do the heavy lifting.
Tactical Holograms are no ordinary challenges. They’re complex, multi-tiered tests of strategy, skill, and patience—designed to push players to their limits. But not everyone has the time to tackle these escalating trials. That’s where we come in. With Skycoach’s Tactical Holograms boosting service, you can select the specific difficulties or a complete range you’d like to conquer. We’ll handle it. Efficiently. Professionally. Always securely.
What You’ll Get
Completion of selected Tactical Hologram challenges, tailored to your preferences.
High-quality Echoes, including 4-star and 5-star Echoes, depending on the difficulty level.
Data Sets to exchange in the Simulation Training Store for Echo materials and Phantom Echoes.
Astrite and performance-enhancing items to boost your team’s strength.
Optional Add-Ons
Express Service:
Accelerate completion for quicker results.
Super Express:
The fastest option for the quickest possible completion of your service.
Skycoach’s boosting service combines the expertise of seasoned players with robust account protection measures. The result? Peace of mind and unparalleled service quality. We don’t just meet expectations—we exceed them, always ensuring your Tactical Hologram journey is both safe and seamless.",https://skycoach.gg/storage/uploads/products/tactical-hologram-boost1736544236_picture_bg.png,"1,99 €",Farming,https://skycoach.gg/wuthering-waves-boost/farming
