Name,Description,Icon,Price,Category,Link
Sonance Casket Farming,"Buy
Sonance Caskets Farming
and get all of them collected in no time.
Sonance Caskets are valuable collectibles in Wuthering Waves. Collecting all the Sonance Caskets can be a challenging task, as they are scattered throughout the vast and diverse regions of the game, often hidden in hard-to-reach locations or guarded by powerful enemies. The WuWa Sonance Caskets Farming Boost provides you with the necessary advantages and shortcuts to locate and gather these coveted items efficiently.
Here's what you'll get:
All Sonance Caskets collected;
All collecting rewards earned;
Fast completion and fair price.
Buy Wuthering Waves Sonance Caskets cheap and dominate Huanglong!",https://skycoach.gg/storage/uploads/products/sonance-casket-farming1717341480_picture_bg.png,"10,99 €",Farming,https://skycoach.gg/wuthering-waves-boost/farming
Blobflies Farming,"Buy
Wuthering Waves
Blobfly Farming
and get all of them collected in no time.
Blobflies are a type of Tacet Discord in Wuthering Waves, which are strange and enticing entities that players can follow to collect them. They can be challenging due to their scattered locations throughout the game's vast regions, often hidden in hard-to-reach areas or guarded by powerful enemies. Our WuWa Blobfly Farming Boost provides the necessary advantages and shortcuts to efficiently locate and gather these coveted items.
Here's what you'll get:
All Blobflies collected;
All collecting rewards earned;
Fast completion and fair price.
Buy WuWa Blobflies Farming at a low price now and dominate the game!",https://skycoach.gg/storage/uploads/products/blobflies-farming1717341488_picture_bg.png,"11,99 €",Farming,https://skycoach.gg/wuthering-waves-boost/farming
Astrite Farming,"Buy
Wuthering Waves Astrite Farming
and elevate your gameplay effortlessly.
Farming Astrite in Wuthering Waves is notoriously difficult due to the time-consuming nature of gathering and the competition for resources. Navigating complex environments, dealing with challenging mobs, and managing limited in-game resources can make this task overwhelming. Additionally, balancing Astrite farming with other in-game objectives can be frustrating.
Here's what you'll get:
A desired amount of Astrite;
Some Resonance Nexus levels;
Daily & Weekly Challenges progression;
Exploration progression;
All other loot that gathered during the service.
At Skycoach, you can buy a Wuthering Waves Astrite Farming service fast and cheap, ensuring you get the resources you need without the grind. Our boosting service offers a professional and efficient carry service, making it an affordable solution to enhance your gaming experience.",https://skycoach.gg/storage/uploads/products/astrite-farming1718262485_picture_bg.png,"1,89 €",Farming,https://skycoach.gg/wuthering-waves-boost/farming
Blade & Soul NEO Powerleveling,"Buy Blade & Soul NEO Powerleveling and speedrun your character progression quickly, effortlessly, and guaranteed. This is a top-tier service for anyone who wants to save a lot of time and doesn't want to struggle for many hours doing boring routines. Let our PROs boost your level to the sky, and your gaming experience will improve drastically!
With our BnS NEO Level Boost, you will get:
Selected character level reached;
Progress through the main story;
All valuable loot and currency obtained during the service.",https://skycoach.gg/storage/uploads/products/blade-soul-neo-powerleveling1742829245_picture_bg.png,"5,27 €",Leveling,https://skycoach.gg/blade-and-soul-neo-boost/leveling
Blade & Soul NEO Dungeons Boost,"Buy Blade & Soul NEO Dungeons boost and get any dungeon easily completed with our PROs' assistance to earn the most valuable rewards. Just like in any MMORPG, dungeons are essential for farming powerful items, and B&S NEO requires a lot of dungeon grinding. It is pretty challenging, and it consumes a lot of time. If you don't want to struggle, choose this service, and will solve all your problems.
With our BnS NEO Dungeons carry, you will get:
The selected number of dungeons of the chosen difficulty completed;
Lots of top-tier loot farmed;
Tons of EXP and other resources.",https://skycoach.gg/storage/uploads/products/blade-soul-neo-dungeons-boost1742923019_picture_bg.png,"2,39 €",Leveling,https://skycoach.gg/blade-and-soul-neo-boost/leveling
Blade & Soul NEO Hourly Driving,"Buy Blade & Soul NEO Hourly Driving and get anything you need with our PRO's assistance quickly, effortlessly, and guaranteed. This is the best choice for anyone who understands the amount of grind to progress and doesn't want to waste their time on such boring routines. Let our professional booster enhance your development multiple times and make you have fun in the game like never before!
With Skycoach's Blade & Soul NEO Hourly Boosting, you will get:
A selected amount of hours played on your account or with you;
A chance to progress like you want and get what you need easily;
Lots of hours saved!",https://skycoach.gg/storage/uploads/products/blade-soul-neo-hourly-driving1742829234_picture_bg.png,"5,49 €",Leveling,https://skycoach.gg/blade-and-soul-neo-boost/leveling
Blade & Soul NEO Quests Boost,"Buy Blade & Soul NEO Quests Boost and get a perfect completion of all Main and Side quests quickly, effortlessly, and guaranteed. As a result, your Character Level will be drastically increased, and you will be close to getting the maximum level. What do you have to do to get all of the in-game quests done? Nothing! How can our PROs help you? They will do all the hard and exhausting work for you, so you can only enjoy the progress and results!
With our BnS NEO Quest carry service, you will get:
All quests of the selected option completed. You can choose between the Main Story quests, Side quests, or both;
Character Level increased (1-36 for the Main Story, 36-45 for Side quests);
All valuable loot and currency obtained during the service.",https://skycoach.gg/storage/uploads/products/blade-soul-neo-quests-boost1742920942_picture_bg.png,"17,99 €",Leveling,https://skycoach.gg/blade-and-soul-neo-boost/leveling
Blade & Soul NEO Divine Gems,"Buy Blade & Soul NEO Divine Gems and get any amount of this primary in-game currency for all your purposes. If you are used to extracting maximum profit from every purchase and want to pay less and get more, then this service is for you! The only thing you need is to choose how many gems you need, and we'll do the rest in the shortest time possible!
With Blade & Soul NEO Divine Gems for sale, you will get:
A selected amount of Divine Gems delivered to your account;
The easiest access to gear enhancement and trading;
Lots of time and money saved!",https://skycoach.gg/storage/uploads/products/blade-soul-neo-divine-gems1742829250_picture_bg.png,"6,94 €",Divine Gems,https://skycoach.gg/blade-and-soul-neo-boost/divine-soul
The Dark Horizon Campaign,"Buy
The Dark Horizon Campaign Boost
and get:
Full completion of The Dark Horizon campaign, including all main missions and story progression;
Unlock key campaign rewards and exclusive items tied to the story;
Progress through N’Erud's newly expanded and vertical areas, engaging with unique environments;
Experience every plot point of the campaign, including interactions with new characters and lore discoveries;
Flexible options for any difficulty level, including selfplay.
The Dark Horizon campaign is tough due to complex maps, unpredictable enemy spawns, and challenging boss fights. N’Erud’s verticality adds extra difficulty, making combat and navigation more frustrating for solo players.
With Skycoach, you get a reliable, fast Remnant II TDH Campaign boosting service that handles all the hard parts for you. We offer selfplay, flexible difficulty options, and prioritize your account’s safety, all while delivering a seamless boosting experience.",https://skycoach.gg/storage/uploads/products/the-dark-horizon-campaign1727191541_picture_bg.webp,"13,09 €",The Dark Horizon,https://skycoach.gg/remnant-2-boost/the-dark-horizon
Warden Unlock,"Buy
Remnant 2 Warden Unlock
and get:
Full Warden Archetype unlock;
Access to unique perks like Dynamic;
Versatile drone abilities (Heal, Shield, and Combat);
Exclusive trait upgrades for shield efficiency.
Unlock the Warden Archetype in Remnant II and gain access to one of the most versatile support classes in the game. The Warden brings powerful drone abilities to the battlefield, offering healing, shielding, and combat support. Whether you're defending allies with the Shield Drone or boosting your team's damage with the Combat Drone, the Warden adapts to any playstyle. By unlocking this Archetype, you'll also benefit from perks like Dynamic, which enhances shield regeneration and increases your drone's energy reserves. Perfect for those who want to master battlefield control and provide crucial support to their team.
At Skycoach, our Remnan 2 Warden unlock service is fast, reliable, and 100% safe. Unlock the Warden and start leading your team with superior support today.",https://skycoach.gg/storage/uploads/products/warden-unlock1726758327_picture_bg.webp,"11,99 €",The Dark Horizon,https://skycoach.gg/remnant-2-boost/the-dark-horizon
Warden Leveling,"Buy
Remnant II Warden Leveling
and get:
Full progression of the Warden class, unlocking all skills, perks, and traits.
Access to the Warden's unique and fully upgraded Prime Perk, which grants powerful abilities when maxed.
Every piece of gear, materials, and equipment collected during the leveling service.
All core and archetype-specific traits and perks unlocked while leveling up the Warden.
Leveling up in Remnant II is time-consuming and requires managing resources, mastering mechanics, and overcoming tough enemies and bosses. By choosing Skycoach's Warden Leveling service, you avoid spending long hours grinding, allowing you to focus on the more enjoyable aspects of the game, like exploring its intricate world and engaging in challenging combat scenarios. Additionally, unlocking the Warden's full potential without the repetitive gameplay lets you experiment with advanced strategies faster.",https://skycoach.gg/storage/uploads/products/warden-leveling1726759716_picture_bg.webp,"2,29 €",The Dark Horizon,https://skycoach.gg/remnant-2-boost/the-dark-horizon
0-51 Prism Leveling,"Buy
Remnant II Prism Leveling
and get:
Prism leveled from 0 to 51, unlocking powerful buffs and stacking bonuses;
4 Fusions of your choice, selected to enhance your specific playstyle or build;
Careful optimization of the 5th stat, with a focus on ensuring maximum synergy with your archetype;
Tailored Legendary Bonus, chosen to amplify your character's strongest abilities;
A fast, efficient service, ensuring all stats are fine-tuned for your build’s needs.
Our team will level your Prism from 0 to 51, ensuring it’s perfectly aligned with your playstyle. We’ll carefully choose 4 Fusions that enhance your build, and for the final 5th stat, our booster will make sure it provides the best synergy with your archetype. Additionally, the Legendary Bonus will be selected to amplify your strengths and abilities. This attention to detail guarantees your Prism will maximize both power and flexibility, allowing you to dominate any challenge in Remnant II.",https://skycoach.gg/storage/uploads/products/prism-leveling1727177243_picture_bg.webp,"53,99 €",The Dark Horizon,https://skycoach.gg/remnant-2-boost/the-dark-horizon
Boss Rush Boost,"Buy
Remnant II Boss Rush Boost
and:
Complete your boss rushes quickly with a skilled team, minimizing the time needed to unlock elusive weapons and rare gear.
Secure rare drops, including weapons, rings, and amulets, which are often difficult to obtain through standard gameplay.
We know the intricacies of every boss and will guide you through even the toughest encounters. Our team of expert players will help you conquer any Boss Rush difficulty, including:
Triple Threat (three bosses);
Trial by Fire (seven bosses);
The Gauntlet (nineteen bosses).
With the addition of the Boss Rush Mode in Remnant II, players are given an exciting, action-packed way to face off against a series of bosses, either solo or with friends. This mode challenges your skill, timing, and strategy as you take on a gauntlet of bosses across varying difficulties. Whether you're stuck on a tough boss, want to speed through content, or aim to collect rare loot, our Boss Rush Boosting Service is here to help.",https://skycoach.gg/storage/uploads/products/boss-rush-boost1727193853_picture_bg.webp,"3,69 €",The Dark Horizon,https://skycoach.gg/remnant-2-boost/the-dark-horizon
Black Greatsword,"Buy Black Greatsword farm In Remnant 2 and get a massive weapon of destruction capable of devastating attacks. It can be enhanced by charging, which consumes Stamina over time. Increases Encumbrance by 15.
Our service includes:
Black Greatsword
obtained;
Indomitable Strike Weapon Mod
;
All the loot gathered during the boost.",https://skycoach.gg/storage/uploads/products/black-greatsword1727268276_picture_bg.png,"26,99 €",The Dark Horizon,https://skycoach.gg/remnant-2-boost/the-dark-horizon
Genesis,"Buy Genesis Farm in Remnant 2 and get a N'Erudian tool with low energy reserves that generate energy bolts. Charging the turbines produces additional projectiles (max 5), rewarding a patient's hand with a devastating volley of perfect strikes.
Our service includes:
Brand new
Genesis Long Gun
obtained;
Mega Drive Weapon Mod
;
All the loot gathered during the boost.",https://skycoach.gg/storage/uploads/products/genesis1727269853_picture_bg.png,"12,99 €",The Dark Horizon,https://skycoach.gg/remnant-2-boost/the-dark-horizon
Dark Matter Gauntlets,"Buy
Dark Matter Gauntlets Farm
and get one of the most powerful melee weapons in Remnant II. The Dark Matter Gauntlets are known for their incredible power and effectiveness in close combat, making them a top-tier choice for melee builds. Our service guarantees quick acquisition of this rare item without the grind.
Here’s what you’ll get:
Dark Matter Gauntlet farmed for you;
Everything gathered during the service;
Fast and safe delivery.
At Skycoach, you can get Dark Matter Gauntlets quickly and affordably.",https://skycoach.gg/storage/uploads/products/dark-matter-gauntlets1727269970_picture_bg.webp,"26,99 €",The Dark Horizon,https://skycoach.gg/remnant-2-boost/the-dark-horizon
Monorail,"Buy Monorail Farm in Remnant 2 and get a powerful weapon that appears to be a melee weapon at first glance, but its true power emerges with a trigger pull, firing a powerful shot or, when charged, unleashing devastating energy.
Our service includes:
Brand new
Monorail
Long Gun
obtained;
Recoil Dampener Weapon Mod
;
All the loot gathered during the boost.",https://skycoach.gg/storage/uploads/products/monorail1727270244_picture_bg.png,"26,99 €",The Dark Horizon,https://skycoach.gg/remnant-2-boost/the-dark-horizon
Harvester Scythe,"Buy
Harvester Scythe Farm
and add this deadly weapon to your arsenal in Remnant II. The Harvester Scythe is perfect for melee-focused players, with high damage output and life-stealing abilities that make it a must-have for challenging encounters. Let us handle the grind for you!
Here’s what you’ll get:
Harvester Scythe farmed for you;
Everything gathered during the service;
Fast and safe delivery.
No more wondering how to get Harvester Scythe - contact us and unlock its brutal close-range combat potential, perfect for tearing through enemies with significant damage and healing abilities in no time.",https://skycoach.gg/storage/uploads/products/harvester-scythe1727270507_picture_bg.webp,"12,99 €",The Dark Horizon,https://skycoach.gg/remnant-2-boost/the-dark-horizon
Redeemer,"Buy
Redeemer Farm
and get this powerful precision weapon in Remnant II. The Redeemer is perfect for players looking to deal high damage from range. Leave the grind to us!
Here’s what you’ll get:
Redeemer farmed for you;
Everything gathered during the service;
Fast and safe delivery.
The Redeemer excels in both mid-range and long-range combat, allowing players to land high-damage shots while staying mobile. Additionally, it pairs well with builds focused on critical hits and ranged damage, making it a strong option for those who prefer tactical and precise playstyles.
At Skycoach, you can easily get Redeemer Hand Gun to unlock new ways to dominate enemies in every challenging encounter.",https://skycoach.gg/storage/uploads/products/redeemer1727270739_picture_bg.webp,"69,99 €",The Dark Horizon,https://skycoach.gg/remnant-2-boost/the-dark-horizon
Repair Tool,"Buy
Remnant II Repair Tool Farm
and unlock it without the grind! This versatile weapon is essential for players who want to heal their team from a distance while still contributing to damage output.
Here’s what you’ll get:
Repair Tool Hand Gun farmed for you;
Everything gathered during the service;
Fast and safe delivery.
The Repair Tool Hand Gun excels at healing from a distance, making it perfect for players focused on supporting their teammates while still packing a punch. Combined with mutator customizations, it becomes an essential tool for any high-level support build in Remnant II.
At Skycoach, our expert team will farm the Repair Tool Hand Gun for you, unlocking new ways to dominate and assist in even the toughest battles!",https://skycoach.gg/storage/uploads/products/repair-tool1727271413_picture_bg.webp,"12,99 €",The Dark Horizon,https://skycoach.gg/remnant-2-boost/the-dark-horizon
Nanoplated Armor Set,"Buy
Remnant II Nanoplated Set Farm
and unlock this lightweight armor, perfect for players who prioritize speed and mobility. This set lets you move faster while maintaining decent protection.
Here’s what you’ll get:
Nanoplated Armor Set farmed for you;
All loot collected during the process;
Fast and secure delivery.
The Nanoplated Armor Set is ideal for builds focused on speed and evasiveness, allowing you to maneuver through intense battles while staying protected. Paired with the right weapons, it enhances your gameplay by keeping you light and agile in combat.
At Skycoach, we farm the Nanoplated Armor Set for you, making sure you're equipped for your next challenge in Remnant II!",https://skycoach.gg/storage/uploads/products/nanoplated-armor-set1727273079_picture_bg.webp,"12,99 €",The Dark Horizon,https://skycoach.gg/remnant-2-boost/the-dark-horizon
Rupture Canon,"Buy
Remnant II Rupture Canon Farm
and unlock it without the grind! This versatile weapon offers a brisk fire rate and medium-range effectiveness, capable of dealing heavy damage and providing a stagger bonus.
Here’s what you’ll get:
Rupture Canon Hand Gun farmed for you;
Everything gathered during the service;
Fast and safe delivery.
At Skycoach, our expert team will farm the Rupture Canon Hand Gun for you, unlocking new ways to dominate and assist in even the toughest battles!",https://skycoach.gg/storage/uploads/products/rupture-canon1727770285_picture_bg.png,"13,99 €",The Dark Horizon,https://skycoach.gg/remnant-2-boost/the-dark-horizon
Phetyr Armor Set,"Buy
Remnant II Phetyr Set Farm
and get a newly introduced heavy armor set that offers substantial protection. It is ideal for players who prefer tanky, defensive builds, allowing them to absorb high amounts of damage. The set can be found in the game's side dungeons, and acquiring it involves some platforming challenges.
Here’s what you’ll get with our Phetyr Set farming service:
Full Phetyr Set farmed and delivered;
All additional loot gathered during the farm;
Fast and secure service to get you geared up quickly;
The Phetyr Set is highly sought after for its heavy armor stats and its ability to enhance tank-style gameplay. If you're looking to bolster your defenses, this set is perfect for enduring tough boss fights or sustained combat.",https://skycoach.gg/storage/uploads/products/phetyr-armor-set1727273814_picture_bg.webp,"12,99 €",The Dark Horizon,https://skycoach.gg/remnant-2-boost/the-dark-horizon
Black Greatsword,"Buy Black Greatsword farm In Remnant 2 and get a massive weapon of destruction capable of devastating attacks. It can be enhanced by charging, which consumes Stamina over time. Increases Encumbrance by 15.
Our service includes:
Black Greatsword
obtained;
Indomitable Strike Weapon Mod
;
All the loot gathered during the boost.",https://skycoach.gg/storage/uploads/products/black-greatsword1727268276_picture_bg.png,"26,99 €",Weapons & Items,https://skycoach.gg/remnant-2-boost/weapons
Genesis,"Buy Genesis Farm in Remnant 2 and get a N'Erudian tool with low energy reserves that generate energy bolts. Charging the turbines produces additional projectiles (max 5), rewarding a patient's hand with a devastating volley of perfect strikes.
Our service includes:
Brand new
Genesis Long Gun
obtained;
Mega Drive Weapon Mod
;
All the loot gathered during the boost.",https://skycoach.gg/storage/uploads/products/genesis1727269853_picture_bg.png,"12,99 €",Weapons & Items,https://skycoach.gg/remnant-2-boost/weapons
Dark Matter Gauntlets,"Buy
Dark Matter Gauntlets Farm
and get one of the most powerful melee weapons in Remnant II. The Dark Matter Gauntlets are known for their incredible power and effectiveness in close combat, making them a top-tier choice for melee builds. Our service guarantees quick acquisition of this rare item without the grind.
Here’s what you’ll get:
Dark Matter Gauntlet farmed for you;
Everything gathered during the service;
Fast and safe delivery.
At Skycoach, you can get Dark Matter Gauntlets quickly and affordably.",https://skycoach.gg/storage/uploads/products/dark-matter-gauntlets1727269970_picture_bg.webp,"26,99 €",Weapons & Items,https://skycoach.gg/remnant-2-boost/weapons
Monorail,"Buy Monorail Farm in Remnant 2 and get a powerful weapon that appears to be a melee weapon at first glance, but its true power emerges with a trigger pull, firing a powerful shot or, when charged, unleashing devastating energy.
Our service includes:
Brand new
Monorail
Long Gun
obtained;
Recoil Dampener Weapon Mod
;
All the loot gathered during the boost.",https://skycoach.gg/storage/uploads/products/monorail1727270244_picture_bg.png,"26,99 €",Weapons & Items,https://skycoach.gg/remnant-2-boost/weapons
Harvester Scythe,"Buy
Harvester Scythe Farm
and add this deadly weapon to your arsenal in Remnant II. The Harvester Scythe is perfect for melee-focused players, with high damage output and life-stealing abilities that make it a must-have for challenging encounters. Let us handle the grind for you!
Here’s what you’ll get:
Harvester Scythe farmed for you;
Everything gathered during the service;
Fast and safe delivery.
No more wondering how to get Harvester Scythe - contact us and unlock its brutal close-range combat potential, perfect for tearing through enemies with significant damage and healing abilities in no time.",https://skycoach.gg/storage/uploads/products/harvester-scythe1727270507_picture_bg.webp,"12,99 €",Weapons & Items,https://skycoach.gg/remnant-2-boost/weapons
Redeemer,"Buy
Redeemer Farm
and get this powerful precision weapon in Remnant II. The Redeemer is perfect for players looking to deal high damage from range. Leave the grind to us!
Here’s what you’ll get:
Redeemer farmed for you;
Everything gathered during the service;
Fast and safe delivery.
The Redeemer excels in both mid-range and long-range combat, allowing players to land high-damage shots while staying mobile. Additionally, it pairs well with builds focused on critical hits and ranged damage, making it a strong option for those who prefer tactical and precise playstyles.
At Skycoach, you can easily get Redeemer Hand Gun to unlock new ways to dominate enemies in every challenging encounter.",https://skycoach.gg/storage/uploads/products/redeemer1727270739_picture_bg.webp,"69,99 €",Weapons & Items,https://skycoach.gg/remnant-2-boost/weapons
Repair Tool,"Buy
Remnant II Repair Tool Farm
and unlock it without the grind! This versatile weapon is essential for players who want to heal their team from a distance while still contributing to damage output.
Here’s what you’ll get:
Repair Tool Hand Gun farmed for you;
Everything gathered during the service;
Fast and safe delivery.
The Repair Tool Hand Gun excels at healing from a distance, making it perfect for players focused on supporting their teammates while still packing a punch. Combined with mutator customizations, it becomes an essential tool for any high-level support build in Remnant II.
At Skycoach, our expert team will farm the Repair Tool Hand Gun for you, unlocking new ways to dominate and assist in even the toughest battles!",https://skycoach.gg/storage/uploads/products/repair-tool1727271413_picture_bg.webp,"12,99 €",Weapons & Items,https://skycoach.gg/remnant-2-boost/weapons
Nanoplated Armor Set,"Buy
Remnant II Nanoplated Set Farm
and unlock this lightweight armor, perfect for players who prioritize speed and mobility. This set lets you move faster while maintaining decent protection.
Here’s what you’ll get:
Nanoplated Armor Set farmed for you;
All loot collected during the process;
Fast and secure delivery.
The Nanoplated Armor Set is ideal for builds focused on speed and evasiveness, allowing you to maneuver through intense battles while staying protected. Paired with the right weapons, it enhances your gameplay by keeping you light and agile in combat.
At Skycoach, we farm the Nanoplated Armor Set for you, making sure you're equipped for your next challenge in Remnant II!",https://skycoach.gg/storage/uploads/products/nanoplated-armor-set1727273079_picture_bg.webp,"12,99 €",Weapons & Items,https://skycoach.gg/remnant-2-boost/weapons
