Name,Description,Icon,Price,Category,Link,GameCharImage
Hire A Fleet,"Hire A Fleet for any of your EVE Online needs to play with a well-coordinated fleet of seasoned game PROs who will ease and enhance your gaming experience multiple times and quicker progression through your game goals.
With our Hire EVE Online Fleet service, you will get:
A whole fleet of PRO players playing with you for the selected number of hours;
Faster progression towards your in-game goals;
Complete safety and fair price.",,"66,99 €",Boosting,https://skycoach.gg/eve-online-boost/boosting,https://skycoach.gg/storage/uploads/products/hire-a-fleet1728367801_picture_item.png
Hourly Driving,"Get our
EVE Online Hourly Driving
boost and have our booster handle all your daily tasks seamlessly. Whether it's farming, logistics, quests completion, or pretty much anything else, inform us of your requirements. This service is perfect for unique requests not listed on our website. Simply buy the desired number of hours, share your specific instructions, and leave the rest to us while you enjoy your leisure time stress-free!
Our professional players will do any in-game task for selected amount of hours;
Streaming if requested.
Let our professional players do all the hard work for you, so you can actually enjoy the game.",,"10,99 €",Boosting,https://skycoach.gg/eve-online-boost/boosting,https://skycoach.gg/storage/uploads/products/hourly-driving1728367741_picture_item.png
Hire A PRO,"Hire A PRO
for any of your EVE Online needs to play with seasoned game PROs who will ease and enhance your gaming experience multiple times and quicker progression through your game goals.
With our Hire EVE Online PRO service, you will get:
A PRO player playing with you for the selected number of hours;
Faster progression towards your in-game goals;
Complete safety and fair price.",,"17,99 €",Boosting,https://skycoach.gg/eve-online-boost/boosting,https://skycoach.gg/storage/uploads/products/hire-a-pro1728367771_picture_item.png
Coaching,"Coaching with some of the best professional players;
Make yourself ready for any possible situation in the waste world of EVE Online;
Unique experience;
Discount if you buy three or more hours of coaching.
Our players will help you understand EVE Online mechanics from basics all the way to the most complex and hard-to-implement strategies. You will learn a lot more about your favorite ship-type and how it is supposed to synergize with other ships; you will know how to win when there is seemingly no hope, and you will become a much better player faster than you could ever dream. You will be prepared for everything.
We guarantee:
Personal and friendly attitude;
Only the best players with many years of experience;
We respect your time, so you can plan your coaching sessions as you please.
If you have any questions or want to place a more specific order, please contact our Customer Support team.",,"17,99 €",Coaching,https://skycoach.gg/eve-online-boost/coaching,https://skycoach.gg/storage/uploads/products/coaching1728367709_picture_item.png
