Name,Description,Icon,Price,Category,Link,GameCharImage
Dark and Darker Powerleveling,"Buy DnD Powerleveling and progress through the game's leveling system quickly and effortlessly. You will get:
Selected level character;
Multiple additional rewards (gold, items, etc.);
Streaming if requested.
The leveling process in Dark and Darker is a really long and tiresome journey. Especially if you are not really familliar with how this game works. Why waste your precious time on the exhausting grind, while you can get our professional help with this Dark and Darker level boost?
Let the professionals do all the boring grind for you!
The safety of your account during the boost is 100% guaranteed.
All our pro-players are professionals with years of experience on the market. They always use premium VPN and follow strict anonymity rules designed to protect your account’s information.
This is the fastest way to level up your character in Dark and Darker!",,"1,96 €",Powerleveling,https://skycoach.gg/dark-and-darker-boost/powerleveling,https://skycoach.gg/storage/uploads/products/dark-and-darker-powerleveling1691971370_picture_item.png
Dark and Darker Hourly Driving,"Buy Dark and Darker Hourly Driving on our platform now and receive:
Any desired task within Dark and Darker;
Experience for your character;
Achievements, quests, and efficiently farm daily activities.
Get our Dark and Darker Hourly Driving and have our booster handle all your daily tasks seamlessly. Whether it's farming, grinding, dungeon completion, or engaging in local activities, just inform us of your requirements. This service is perfect for unique requests not listed on our website. Simply buy the desired number of hours, share your specific instructions, and leave the rest to us while you enjoy your leisure time stress-free!
Let our professional players do all the hard work for you, so you can actually enjoy the game.",,"8,99 €",Powerleveling,https://skycoach.gg/dark-and-darker-boost/powerleveling,https://skycoach.gg/storage/uploads/products/dark-and-darker-hourly-driving1691971416_picture_item.png
Dark and Darker Rank Boost,"Buy
Dark and Darker Rank Boost
and get:
A desired rank from Neophyte to Demigod;
All drops during the service.
With our Dark and Darker Rank carry, you can quickly advance through the ranks and gain a competitive edge. Our team will help you reach your desired rank efficiently, enhancing your overall gameplay experience and unlocking exclusive rewards.
How to Select Rank:
Start by identifying your current rank by selecting the number that corresponds to it from the list provided. Next, choose the number for the rank you wish to reach. Once you have both numbers, provide them to us, and our team will handle the rest. Use the list below.
Neophyte: III (1), II (2), I (3);
Apprentice: III (4), II (5), I (6);
Wanderer: III (7), II (8), I (9);
Pathfinder: III (10), II (11), I (12);
Voyager: III (13), II (14), I (15);
Exemplar: III (16), II (17), I (18);
Demigod: (19).",,"2,79 €",Powerleveling,https://skycoach.gg/dark-and-darker-boost/powerleveling,https://skycoach.gg/storage/uploads/products/dark-and-darker-rank-boost1736930551_picture_item.png
Dark and Darker Bosses Boost,"Buy Dark and Darker Bosses Boost on our platform now and receive:
Selected Dark and Darker Bosses killed;
All difficulties available;
Multiple additional rewards (gold, items, etc.);
Streaming if requested.
Our Dark and Darker Bosses carry is the simplest method to acquire abundant loot and experience for your character. Our expert team will extend an invitation to join a group, leading you through your chosen dungeon, and ensuring you receive all loot upon completion.",,"5,39 €",Raids,https://skycoach.gg/dark-and-darker-boost/raids,https://skycoach.gg/storage/uploads/products/dark-and-darker-bosses-boost1737612409_picture_item.png
Dark and Darker Dungeons Boost,"Buy Dark and Darker Dungeons Boost on our platform now and receive:
Selected Dark and Darker Dungeons completed;
All difficulties available;
Multiple additional rewards (gold, items, etc.);
Streaming if requested.
Our Dark and Darker Dungeons carry is the simplest method to acquire abundant loot and experience for your character. Our expert team will extend an invitation to join a group, leading you through your chosen dungeon, and ensuring you receive all loot upon completion.",,"7,68 €",Raids,https://skycoach.gg/dark-and-darker-boost/raids,https://skycoach.gg/storage/uploads/products/dark-and-darker-dungeons-boost1737611400_picture_item.png
Dark and Darker Raid Boost,"Buy Dark and Darker Raid Boost on our platform now and receive:
Selected Dark and Darker Raid completed;
All difficulties available;
Multiple additional rewards (gold, items, etc.);
Streaming if requested.
Our Dark and Darker Raid carry is the simplest method to acquire abundant loot and experience for your character. Our expert team will extend an invitation to join a group, leading you through your chosen dungeon, and ensuring you receive all loot upon completion. These Raid Carry services by Dark and Darker are accessible for dungeons across all servers.",,"8,99 €",Raids,https://skycoach.gg/dark-and-darker-boost/raids,https://skycoach.gg/storage/uploads/products/dark-and-darker-raid-boost1693604616_picture_item.png
