Name,Description,Icon,Price,Category,Link,GameCharImage
Elden Ring Radagon and Elden Beast Kill,"Buy Elden Ring Radagon and Elden Beast Kill boost on our platform and enjoy the fastest delivery and the best prices!
Struggle to defeat the two last bosses in Elden Ring? Well, you have come to the right place! Our PROs will help you kill this boss in no time!
Opt for our Elden Ring Radagon and Elden Beast Kill carry and receive:
Radagon and Elden Beast killed;
All the loot and resources dropped during the service completion;
Complete safety and 24/7 support.",,"11,49 €",Bosses,https://skycoach.gg/elden-ring-boost/bosses,https://skycoach.gg/storage/uploads/products/elden-ring-radagon-and-elden-beast-kill1720478599_picture_item.png
Elden Ring Bosses Boost,"Buy
Elden Ring Bosses
boost
on our platform and enjoy the fastest delivery and the best prices!
Struggle to defeat a particular boss in
Elden Ring?
Well, you have come to the right place! Our PROs will defeat any boss first try for you!
Opt for our Elden Ring Bosses carry and receive:
Selected Elden Ring bosses defeated;
All the loot and resources dropped during the service completion;
Complete safety and 24/7 support.",,"7,00 €",Bosses,https://skycoach.gg/elden-ring-boost/bosses,https://skycoach.gg/storage/uploads/products/elden-ring-bosses-boost1720478631_picture_item.png
"Elden Ring Radahn, Promised Consort Kill","Buy Elden Ring Radahn, Promised Consort Kill boost on our platform, and enjoy the fastest delivery and the best prices!
Struggle to defeat Radahn, Promised Consort in Elden Ring? Well, you have come to the right place! Our PROs will help you kill this boss in no time!
Opt for our Elden Ring Radahn, Promised Consort Kill carry and receive:
Radahn, Promised Consort killed;
All the loot and resources dropped during the service completion;
Complete safety and 24/7 support.",,"10,99 €",Bosses,https://skycoach.gg/elden-ring-boost/bosses,https://skycoach.gg/storage/uploads/products/elden-ring-radahn-promised-consort-kill1720478657_picture_item.png
Elden Ring Malenia Blade of Miquella Kill,"Buy Elden Ring Malenia Blade of Miquella Kill boost on our platform and enjoy the fastest delivery and the best prices!
Struggle to defeat Malenia in Elden Ring? Well, you have come to the right place! Our PROs will help you kill this boss in no time!
Opt for our Elden Ring Malenia Blade of Miquella Kill carry and receive:
Malenia Blade of Miquella killed;
All the loot and resources dropped during the service completion;
Complete safety and 24/7 support.",,"12,49 €",Bosses,https://skycoach.gg/elden-ring-boost/bosses,https://skycoach.gg/storage/uploads/products/elden-ring-malenia-blade-of-miquella-kill1720154184_picture_item.png
Elden Ring PVE Builds,"Buy Elden Ring PVE Builds boost on our platform and enjoy the fastest delivery and the best prices!
Struggle to progress through the game because you do not know how to properly build your character in Elden Ring? Well, you have come to the right place! Our PROs will help you get the most capable PVE build, so you can start dominating The Lands Between!
Opt for our Elden Ring PVE Builds carry and receive:
Powerful PVE build with selected main stat and level (specify the details with our Customer Support manager);
All the loot and resources dropped during the service completion;
Complete safety and 24/7 support.",,"14,49 €",Builds,https://skycoach.gg/elden-ring-boost/builds,https://skycoach.gg/storage/uploads/products/elden-ring-pve-builds1718617137_picture_item.png
Elden Ring Romina Kill,"Buy Elden Ring Romina Kill boost on our platform, and enjoy the fastest delivery and the best prices!
Struggle to defeat Romina in Elden Ring? Well, you have come to the right place! Our PROs will help you kill this boss in no time!
Opt for our Elden Ring Romina Kill carry and receive:
Romina killed;
All the loot and resources dropped during the service completion;
Complete safety and 24/7 support.",,"9,49 €",Bosses,https://skycoach.gg/elden-ring-boost/bosses,https://skycoach.gg/storage/uploads/products/elden-ring-romina-kill1720478686_picture_item.png
Elden Ring PVP Builds,"Buy Elden Ring PVP Builds boost on our platform and enjoy the fastest delivery and the best prices!
Struggle to defeat other players in Elden Ring? Well, you have come to the right place! Our PROs will help you get the most capable PVP build, so you can start dominating The Lands Between!
Opt for our Elden Ring PVP Builds carry and receive:
Powerful PVP build with selected main stat and level (specify the details with our Customer Support manager);
All the loot and resources dropped during the service completion;
Complete safety and 24/7 support.",,"14,49 €",Builds,https://skycoach.gg/elden-ring-boost/builds,https://skycoach.gg/storage/uploads/products/elden-ring-pvp-builds1718698945_picture_item.png
Elden Ring Items Mega Pack,"Buy Elden Ring Items Mega Pack boost on our platform and enjoy the fastest delivery and the best prices!
With this bundle, you will have every piece of equipment, spell, Ash of War, plenty of upgraded weapons, and tons of crafting materials! Make your character ready for everything in no time; contact us now and get started!
You will receive:
100+ level character;
All talismans;
All Ashes of War;
All armor sets;
All weapons fully upgraded (+10 or +25);
All crafting materials;
All other loot and resources dropped during the service completion;
Complete safety and 24/7 support.",,"59,99 €",Gearing,https://skycoach.gg/elden-ring-boost/gearing,https://skycoach.gg/storage/uploads/products/elden-ring-items-mega-pack1728367612_picture_item.png
Elden Ring Items Upgrade Boost,"Buy Elden Ring Items Upgrade boost on our platform and enjoy the fastest delivery and the best prices!
Are you struggling to upgrade your favorite weapon or ash in Elden Ring? Well, you have come to the right place! Our PROs will gladly do this for you!
Opt for our Elden Ring Items upgrade service and receive:
Selected item upgrades obtained;
All the loot and resources dropped during the service completion;
Complete safety and 24/7 support.",,"1,89 €",Gearing,https://skycoach.gg/elden-ring-boost/gearing,https://skycoach.gg/storage/uploads/products/elden-ring-items-upgrades-boost1718617120_picture_item.png
Legendary Armaments,"Buy Elden Ring Legendary Armaments to obtain one of the best weapons in the entire game! As often happens, the most powerful gear is the rarest and hardest to get. Obtaining neither of them is an easy task; however, you can delegate all the hard work to Skycoach's professionals and enjoy the game with top-tier weapons for any Class. With our Elden Ring Armaments carry, you can even get the Legendary Armaments trophy and achievement for all 9 weapons.
You will get:
Every Legendary Armament you choose;
The Legendary Armaments trophy and achievement (if you choose all 9 weapons).
All Bosses that drop the Armaments killed;
All Quests necessary for the Armaments completed.
Prepare to beat Elden Ring's main game and DLC much easier!",,"11,99 €",Gearing,https://skycoach.gg/elden-ring-boost/gearing,https://skycoach.gg/storage/uploads/products/legendary-armaments1719910601_picture_item.png
Smithing Materials Farming,"Buy Elden Ring Smithing Materials to get a chance to upgrade all your Gear up to the maximum! All Smithing materials, such as Smithing Stones, Somber Smithing Stones, Grave Glovewort, and Ghost Glovewort, are scattered around The Lands Between. Collecting enough to upgrade all desired weapons and inventory can be very long and tedious. However, Skycoach can fix that! With our Elden Ring Materials farm, you can upgrade your Gear as much as you want effortlessly!
You will get:
Chosen amount of desired Material packs (each pack contains 10 Materials);
Any Material Tier that you choose, up to the highest: Ancient Dragon Smithing Stones, Somber Ancient Dragon Smithing Stones, Great Grave Glovewort, and Great Ghost Glovewort.
A possibility of maximizing your Gear's stats.
Prepare to beat Elden Ring's main game and DLC much easier!",,"6,49 €",Gearing,https://skycoach.gg/elden-ring-boost/gearing,https://skycoach.gg/storage/uploads/products/smithing-materials1719910810_picture_item.png
Flask Upgrades,"Buy Elden Ring Flask Upgrades to maximize the amount of healing and FP restoration effortlessly. Both Sacred Tears and Golden Seeds are hard-to-find Materials scattered around the entire huge open-world map. Golden Seeds increase the amount of Flasks available, while Sacred Tears increase their effectiveness. You can get them all without struggling with our Sacred Tears and Golden Seeds service.
You will obtain:
The chosen amount of Sacred Tears or Golden Seeds;
A possibility to maximally upgrade your Crimson and Cerulean Flasks.
Prepare to beat Elden Ring's main game and DLC much easier!",,"2,84 €",Gearing,https://skycoach.gg/elden-ring-boost/gearing,https://skycoach.gg/storage/uploads/products/flask-upgrades1719910748_picture_item.png
Elden Ring Weapons,"Buy Elden Ring Weapons to get any Weapon you wish, available for any Class. We have gathered all Main Boss (Remembrance) and all other (non-remembrance) weapons, so you can choose your favorite one and slay everything right from the start, no grind. You can also check our
Legendary Armaments Weapons
to get the game's most powerful weapons! With our Elden Ring Weapons unlock, you can don't need to worry about how hard the Boss dropping your desired weapon will be.
You will get:
Any Remembrance or Non-Remembrance weapon you choose;
Bosses dropping your desired weapons slain;
Quests necessary for your desired weapons completed.
Prepare to beat Elden Ring's main game and DLC much easier!",,"8,49 €",Gearing,https://skycoach.gg/elden-ring-boost/gearing,https://skycoach.gg/storage/uploads/products/elden-ring-weapons1719574034_picture_item.png
Elden Ring Talismans,"Buy Elden Ring Talismans to get best Talismans from different categories, including all DLC Talismans. We have gathered the most important Talismans of different purposes, tiers, and rarity at one place, so you can choose whatever Talismans you need.  With our Elden Ring Talismans unlock, you can don't need to search through entire map trying to find what fits you best.
You will get:
Any Talisman you choose;
Bosses dropping your desired Talismans slain;
Quests necessary for your desired Talismans completed.
Prepare to beat Elden Ring's main game and DLC much easier!",,"0,99 €",Gearing,https://skycoach.gg/elden-ring-boost/gearing,https://skycoach.gg/storage/uploads/products/elden-ring-talismans1719910865_picture_item.png
Rune Arcs,"Buy Elden Ring Rune Arcs farm and quickly get as many of these valuable consumables as you need!
Farming rare consumables you need so much in the game can be a really tiresome and long process. However, Skycoach can fix that! With our Elden Ring Rune Arcs for sale, you can always have enough of anything effortlessly!
You will get:
Selected amount of Rune Arcs;
All other loot and resources dropped during the service completion.",,"1,82 €",Gearing,https://skycoach.gg/elden-ring-boost/gearing,https://skycoach.gg/storage/uploads/products/rune-arcs1728367653_picture_item.png
