Name,Description,Icon,Price,Category,Link,GameCharImage
OSRS Wintertodt Boost (Normal),"The
Wintertodt boss killed as many times as you want;
750+ points crates for x2 rewards (for 100 kills);
All the EXP and coins gathered during the service;
Complete safety and fair price.
Tackling the treacherous Wintertodt boss in Oldschool RuneScape can be a daunting task, but fear not! With our expert assistance, you can conquer this formidable foe with ease. Buy Wintertodt Boost, and our experienced team will guide you to victory, ensuring you emerge triumphant.
Why make things harder than they need to be? Don't waste your time searching for allies or facing Wintertodt alone. Choose our affordable Wintertodt Kill service, and let us turn this challenge into a seamless adventure, complete with valuable rewards and bragging rights to show off to your friends. Trust us to make your Oldschool RuneScape experience unforgettable!",,"5,49 €",Bosses,https://skycoach.gg/runescape-os-boost/bosses,https://skycoach.gg/storage/uploads/products/osrs-wintertodt-boost-normal1703856090_picture_item.png
OSRS Chambers of Xeric Boost (Normal),"All the bosses
of the
Chambers of Xeric
(Cox) raid defeated
Chance to get powerful
gear
and other
loot
dropped from the bosses of the raid;
All the
EXP
and
coins
gathered during the service;
Complete safety and fair price.
Chambers of Xeric
(Cox) raid is a high-level group activity in Oldschool RuneScape where players venture into the ancient chambers of the mountainous region of Great Kourend. The goal is to defeat various bosses and challenges, working together with a team of up to 100 players to earn valuable rewards such as rare items and experience points. Cox raids require a high level of skill, strategy, and coordination, making it a challenging but rewarding experience for players.
Why make things harder than they need to be?
Don't waste your time searching for allies or facing all the
CoX bosses
alone. Choose our affordable Chambers of Xeric boost service, and let us turn this challenge into a seamless adventure, complete with valuable rewards and bragging rights to show off to your friends. Trust us to make your Oldschool RuneScape experience unforgettable!",,"7,99 €",Bosses,https://skycoach.gg/runescape-os-boost/bosses,https://skycoach.gg/storage/uploads/products/osrs-chambers-of-xeric-boost-normal1703856100_picture_item.png
OSRS Utility Skills Leveling,"Buy OSRS Utility Skills Leveling boost on our platform now and receive:
The chosen amount of EXP for the chosen Utility skill;
All the loot gathered during the boost;
Fair Price and Complete Safety.
Leveling your skills is a very boring task in any MMORPG, and OSRS is no exception. It can take countless hours of playing to get our profession to a much-desired high level.
Happily the Skycoach team will gladly help with that. Our pro-players will level up any skill for you using the most efficient methods in no time at all! Let us do all the job for you and just enjoy the results! Our prices are reasonable and we always dedicate all our efforts to ensure the safety of your account. Contact us now and get started with your OSRS Utility Skills Leveling carry!",,"13,99 €",Leveling,https://skycoach.gg/runescape-os-boost/leveling,https://skycoach.gg/storage/uploads/products/osrs-utility-skills-leveling1703856032_picture_item.png
OSRS Sol Heredit Kill,"Buy Sol Heredit Kill Boost on our platform now and receive:
T
he Sol Heredit boss killed on Echo or Normal difficulties;
Sunlight Spear and Sunlit Bracers obtained;
All the EXP and coins gathered during the service;
Complete safety and fair price.
Tackling the Cerberus boss in Oldschool RuneScape can be a daunting task, especially on Echo difficulty, but fear not! With our expert assistance, you can conquer this formidable foe with ease. Buy Sol Heredit Kill Carry, and our experienced team will guide you to victory, ensuring you emerge triumphant.",,"9,29 €",Bosses,https://skycoach.gg/runescape-os-boost/bosses,https://skycoach.gg/storage/uploads/products/osrs-sol-heredit-kill1733374440_picture_item.png
OSRS Tempoross Boost (Normal),"The Tempoross boss killed as many times as you want;
Up to 500 reward permits per 100 kills;
Lots of fishing EXP and some cooking EXP for your character;
All the EXP and coins gathered during the service;
Complete safety and fair price.
Tackling the treacherous Tempoross boss in Oldschool RuneScape can be a daunting task, but fear not! With our expert assistance, you can conquer this formidable foe with ease. Buy Tempoross Boost, and our experienced team will guide you to victory, ensuring you emerge triumphant.
Why make things harder than they need to be? Don't waste your time searching for allies or facing Tempoross alone. Choose our affordable Tempoross Kill service, and let us turn this challenge into a seamless adventure, complete with valuable rewards and bragging rights to show off to your friends. Trust us to make your Oldschool RuneScape experience unforgettable!",,"8,29 €",Bosses,https://skycoach.gg/runescape-os-boost/bosses,https://skycoach.gg/storage/uploads/products/osrs-tempoross-boost-normal1703856094_picture_item.png
OSRS Production Skills Leveling,"Buy OSRS Production Skills Leveling boost on our platform now and receive:
The chosen amount of EXP for the chosen Production skill;
All the loot gathered during the boost;
Fair Price and Complete Safety.
Leveling your skills is a very boring task in any MMORPG, and OSRS is no exception. It can take countless hours of playing to get our profession to much desired high level.
Happily the Skycoach team will gladly help with that. Our pro-players will level up any skill for you using the most efficient methods in no time at all! Let us do all the job for you and just enjoy the results! Our prices are reasonable and we always dedicate all our efforts to ensure the safety of your account. Contact us now and get started with your OSRS Production Skills Leveling carry.",,"13,99 €",Leveling,https://skycoach.gg/runescape-os-boost/leveling,https://skycoach.gg/storage/uploads/products/osrs-production-skills-leveling1703856026_picture_item.png
OSRS Kalphite Queen Kill,"Buy Kalphite Queen Kill Boost on our platform now and receive:
The Kalphite Queen boss killed on Echo or Normal difficulties;
Drygore Blowpipe obtained;
All the EXP and coins gathered during the service;
Complete safety and fair price.
Tackling the Kalphite Queen boss in Oldschool RuneScape can be a daunting task, especially on Echo difficulty, but fear not! With our expert assistance, you can conquer this formidable foe with ease. Buy Kalphite Queen Kill Carry, and our experienced team will guide you to victory, ensuring you emerge triumphant.",,"9,29 €",Bosses,https://skycoach.gg/runescape-os-boost/bosses,https://skycoach.gg/storage/uploads/products/osrs-kalphite-queen-kill1733322918_picture_item.png
OSRS Combat Skills Leveling,"Buy OSRS Combat Skills Leveling and increase your progress significantly at the best platform with 100% security and guaranteed results! You will get:
The chosen amount of EXP for the chosen
combat skill
;
All the
loot
gathered during the boost;
Fair Price
and
Complete Safety.
L
eveling your
skills
is a very boring task in any MMORPG and
OSRS
is no exception. It can take countless hours of playing to get our profession to much desired high level.
Luckily, our OSRS Combat Skills carry will easily help with that. Our pro-players will level up any
skill
for you using the most efficient methods in no time at all! Let us do all the job for you and just enjoy the results! Our prices are reasonable and we always dedicate all our efforts to ensure the safety of your account.",,"9,29 €",Leveling,https://skycoach.gg/runescape-os-boost/leveling,https://skycoach.gg/storage/uploads/products/osrs-combat-skills-leveling1703856015_picture_item.png
OSRS Zulrah Boost (Ironman),"Th
e Zulrah boss killed as many times as you want;
All the EXP and coins gathered during the service;
Complete safety and fair price.
Tackling the treacherous Zulrah boss in Oldschool RuneScape can be a daunting task, but fear not! With our expert assistance, you can conquer this formidable foe with ease. Buy Zulrah Boost, and our experienced team will guide you to victory, ensuring you emerge triumphant.
Why make things harder than they need to be? Don't waste your time searching for allies or facing Zulrah alone. Choose our affordable Zulrah Kill service, and let us turn this challenge into a seamless adventure, complete with valuable rewards and bragging rights to show off to your friends. Trust us to make your Oldschool RuneScape experience unforgettable!",,"14,99 €",Bosses,https://skycoach.gg/runescape-os-boost/bosses,https://skycoach.gg/storage/uploads/products/osrs-zulrah-boost-ironman1703856084_picture_item.png
OSRS Gathering Skills Leveling,"Buy OSRS Gathering Skills Leveling boost on our platform now and receive:
The chosen amount of EXP for the chosen Gathering skill;
All the loot gathered during the boost;
Fair Price and Complete Safety.
Leveling your skills is a very boring task in any MMORPG, and OSRS is no exception. It can take countless hours of playing to get our profession to a much desired high level.
Happily, the Skycoach team will gladly help with that. Our OSRS Gathering Skills Leveling carry is the best way to level up any skill! Our players are using the most efficient methods in no time at all! Let us do all the job for you and just enjoy the results! Our prices are reasonable and we always dedicate all our efforts to ensure the safety of your account.",,"13,99 €",Leveling,https://skycoach.gg/runescape-os-boost/leveling,https://skycoach.gg/storage/uploads/products/osrs-gathering-skills-leveling1703856021_picture_item.png
OSRS King Black Dragon Kill,"B
uy King Black Dragon Kill Boost on our platform now and receive:
The King Black Dragon boss killed on Echo or Normal difficulties;
Thunder Khopesh and Thousand-Dragon Ward obtained;
All the EXP and coins gathered during the service;
Complete safety and fair price.
Tackling the King Black Dragon boss in Oldschool RuneScape can be a daunting task, especially on Echo difficulty, but fear not! With our expert assistance, you can conquer this formidable foe with ease. Buy King Black Dragon Kill Carry, and our experienced team will guide you to victory, ensuring you emerge triumphant.",,"9,29 €",Bosses,https://skycoach.gg/runescape-os-boost/bosses,https://skycoach.gg/storage/uploads/products/osrs-king-black-dragon-kill1733338389_picture_item.png
OSRS Cerberus Kill,"Buy
Cerberus Kill Boost on our platform now and receive:
The Cerberus boss killed on Echo or Normal difficulties;
The Dogsword obtained;
All the EXP and coins gathered during the service;
Complete safety and fair price.
Tackling the Cerberus boss in Oldschool RuneScape can be a daunting task, especially on Echo difficulty, but fear not! With our expert assistance, you can conquer this formidable foe with ease. Buy Cerberus Kill Carry, and our experienced team will guide you to victory, ensuring you emerge triumphant.",,"9,29 €",Bosses,https://skycoach.gg/runescape-os-boost/bosses,https://skycoach.gg/storage/uploads/products/osrs-cerberus-kill1733337650_picture_item.png
OSRS Grotesque Guardians Kill,"Buy Grotesque Guardians Kill Boost on our platform now and receive:
The Grotesque Guardians boss killed on Echo or Normal difficulties;
Gloves of the Damned obtained;
All the EXP and coins gathered during the service;
Complete safety and fair price.
Tackling the Grotesque Guardians boss in Oldschool RuneScape can be a daunting task, especially on Echo difficulty, but fear not! With our expert assistance, you can conquer this formidable foe with ease. Buy Grotesque Guardians Kill Carry, and our experienced team will guide you to victory, ensuring you emerge triumphant.",,"9,29 €",Bosses,https://skycoach.gg/runescape-os-boost/bosses,https://skycoach.gg/storage/uploads/products/osrs-grotesque-guardians-kill1733370316_picture_item.png
OSRS Thermonuclear Smoke Devil Kill,"Buy Thermonuclear Smoke Devil Kill Boost on our platform now and receive:
The Thermonuclear Smoke Devil boss killed on Echo or Normal difficulties;
Devil's Element obtained;
All the EXP and coins gathered during the service;
Complete safety and fair price.
Tackling the Thermonuclear Smoke Devil boss in Oldschool RuneScape can be a daunting task, especially on Echo difficulty, but fear not! With our expert assistance, you can conquer this formidable foe with ease. Buy Thermonuclear Smoke Devil Kill Carry, and our experie
nced team will guide you to victory, ensuring you emerge triumphant.",,"9,29 €",Bosses,https://skycoach.gg/runescape-os-boost/bosses,https://skycoach.gg/storage/uploads/products/osrs-thermonuclear-smoke-devil-kill1733373592_picture_item.png
OSRS Corrupted Hunllef Kill,"Buy Corrupted Hunllef Kill Boost on our platform now and receive:
The Corrupted Hunllef boss killed on Echo or Normal difficulties;
Crystal Blessing obtained;
All the EXP and coins gathered during the service;
Complete safety and fair price.
Tackling the Corrupted Hunllef boss in Oldschool RuneScape can be a daunting task, especially on Echo difficulty, but fear not! With our expert assistance, you can conquer this formidable foe with ease. Buy Corrupted Hunllef Kill Carry, and our experienced team will guide you to victory, ensuring you emerge triumphant.",,"9,29 €",Bosses,https://skycoach.gg/runescape-os-boost/bosses,https://skycoach.gg/storage/uploads/products/osrs-corrupted-hunllef-kill1733373808_picture_item.png
OSRS Dagannoth Kings Kill,"Buy Dagannoth Kings Kill Boost on our platform now and receive:
The
Dagannoth Kings
boss killed on Echo or Normal difficulties;
Amulet of the Monarchs
and
Emperor Ring
obtained;
All the
EXP
and
coins
gathered during the service;
Complete safety and fair price.
Tackling the Dagannoth Kings boss in Oldschool RuneScape can be a daunting task, especially on Echo difficulty, but fear not! With our expert assistance, you can conquer this formidable foe with ease. Buy
Dagannoth Kings Kill Carry,
and our experienced team will guide you to victory, ensuring you emerge triumphant.",,"9,29 €",Bosses,https://skycoach.gg/runescape-os-boost/bosses,https://skycoach.gg/storage/uploads/products/osrs-dagannoth-kings-kill1733371794_picture_item.png
OSRS Hespori Kill,"B
uy Hespori Kill Boost on our platform now and receive:
The Hespori boss killed on Echo or Normal difficulties;
Nature's Reprisal obtained;
All the EXP and coins gathered during the service;
Complete safety and fair price.
Tackling the Hespori boss in Oldschool RuneScape can be a daunting task, especially on Echo difficulty, but fear not! With our expert assistance, you can conquer this formidable foe with ease. Buy Hespori Kill Carry, and our experienced team will guide you to victory, ensuring you emerge triumphant.",,"9,29 €",Bosses,https://skycoach.gg/runescape-os-boost/bosses,https://skycoach.gg/storage/uploads/products/osrs-hespori-kill1733374111_picture_item.png
Chambers of Xeric Boost,"Buy OSRS Chambers of Xeric Raid Boost and get as many raid KCs as you need. On Normal or Challenge, Solo or together, our PROs will provide guaranteed completions so you can upgrade and loot up quickly and effortlessly! You will get:
The selected number of Chambers of Xeric Boost Raid completions;
All completion variations: Normal and Challenge Modes, Solo and in a party;
Tons of money and decent chances to get valuable gear drops;
Progress towards Xerician capes on Challenge mode.",,"7,49 €",Raids,https://skycoach.gg/runescape-os-boost/raids,https://skycoach.gg/storage/uploads/products/chambers-of-xeric-boost1733338774_picture_item.png
Theatre of Blood Boost,"Buy OSRS Theatre of Blood Raid Boost and get as many raid KCs as you need. On Normal or Hard, our PROs will provide guaranteed completions so you can upgrade and loot up quickly and effortlessly! You will get:
The selected number of Theatre of Blood Boost Raid completions;
Normal and Hard Mode options;
Tons of money and decent chances to get valuable gear drops;
Progress on Combat Achievements;
Progress towards Sinhaza shrouds.",,"13,99 €",Raids,https://skycoach.gg/runescape-os-boost/raids,https://skycoach.gg/storage/uploads/products/theatre-of-blood-boost1733339928_picture_item.png
Tombs of Amascut Boost,"Buy OSRS Tombs of Amascut Raid Boost and get as many raid KCs as you need. On Normal or Hard, our PROs will provide guaranteed completions so you can upgrade and loot up quickly and effortlessly! You will get:
The selected number of Theatre of Blood Boost Raid completions;
Raid Level choice options;
Tons of money and decent chances to get valuable gear drops;
Progress on Combat Achievements;
Progress towards Icthlarin's shrouds.",,"5,79 €",Raids,https://skycoach.gg/runescape-os-boost/raids,https://skycoach.gg/storage/uploads/products/tombs-of-amascut-boost1733342025_picture_item.png
